ProductName,Price
WHITE HANGING HEART T-LIGHT HOLDER,3615
WHITE METAL LANTERN,4959
CREAM CUPID HEARTS COAT HANGER,6880
KNITTED UNION FLAG HOT WATER BOTTLE,6754
RED WOOLLY HOTTIE WHITE HEART.,1354
SET 7 BABUSHKA NESTING BOXES,6947
GLASS STAR FROSTED T-LIGHT HOLDER,1619
HAND WARMER UNION JACK,1217
HAND WARMER RED POLKA DOT,4042
ASSORTED COLOUR BIRD ORNAMENT,2530
POPPY'S PLAYHOUSE BEDROOM ,3828
POPPY'S PLAYHOUSE KITCHEN,6575
FELTCRAFT PRINCESS CHARLOTTE DOLL,1588
IVORY KNITTED MUG COSY ,5206
BOX OF 6 ASSORTED COLOUR TEASPOONS,4996
BOX OF VINTAGE JIGSAW BLOCKS ,3254
BOX OF VINTAGE ALPHABET BLOCKS,3940
HOME BUILDING BLOCK WORD,4427
LOVE BUILDING BLOCK WORD,1011
RECIPE BOX WITH METAL HEART,1070
DOORMAT NEW ENGLAND,5997
JAM MAKING SET WITH JARS,2736
RED COAT RACK PARIS FASHION,6255
YELLOW COAT RACK PARIS FASHION,3218
BLUE COAT RACK PARIS FASHION,1193
BATH BUILDING BLOCK WORD,6869
ALARM CLOCK BAKELIKE PINK,3751
ALARM CLOCK BAKELIKE RED ,1520
ALARM CLOCK BAKELIKE GREEN,4702
PANDA AND BUNNIES STICKER SHEET,4597
STARS GIFT TAPE ,4341
INFLATABLE POLITICAL GLOBE ,2705
VINTAGE HEADS AND TAILS CARD GAME ,4082
SET/2 RED RETROSPOT TEA TOWELS ,1085
ROUND SNACK BOXES SET OF4 WOODLAND ,5507
SPACEBOY LUNCH BOX ,3674
LUNCH BOX I LOVE LONDON,3582
CIRCUS PARADE LUNCH BOX ,4759
CHARLOTTE BAG DOLLY GIRL DESIGN,6747
RED TOADSTOOL LED NIGHT LIGHT,2779
 SET 2 TEA TOWELS I LOVE LONDON ,5055
VINTAGE SEASIDE JIGSAW PUZZLES,4619
MINI JIGSAW CIRCUS PARADE ,6772
MINI JIGSAW SPACEBOY,3624
MINI PAINT SET VINTAGE ,5965
POSTAGE,4207
PAPER CHAIN KIT 50'S CHRISTMAS ,5650
HAND WARMER RED POLKA DOT,3373
HAND WARMER UNION JACK,3795
WHITE HANGING HEART T-LIGHT HOLDER,4382
WHITE METAL LANTERN,5257
CREAM CUPID HEARTS COAT HANGER,4312
EDWARDIAN PARASOL RED,2415
RETRO COFFEE MUGS ASSORTED,1375
SAVE THE PLANET MUG,4656
VINTAGE BILLBOARD DRINK ME MUG,3135
VINTAGE BILLBOARD LOVE/HATE MUG,2686
WOOD 2 DRAWER CABINET WHITE FINISH,3478
WOOD S/3 CABINET ANT WHITE FINISH,5467
WOODEN PICTURE FRAME WHITE FINISH,6909
WOODEN FRAME ANTIQUE WHITE ,1332
KNITTED UNION FLAG HOT WATER BOTTLE,1458
RED WOOLLY HOTTIE WHITE HEART.,5626
SET 7 BABUSHKA NESTING BOXES,4956
GLASS STAR FROSTED T-LIGHT HOLDER,1024
VICTORIAN SEWING BOX LARGE,4085
WHITE HANGING HEART T-LIGHT HOLDER,1793
WHITE METAL LANTERN,2421
CREAM CUPID HEARTS COAT HANGER,2330
EDWARDIAN PARASOL RED,2041
RETRO COFFEE MUGS ASSORTED,2093
SAVE THE PLANET MUG,2835
VINTAGE BILLBOARD DRINK ME MUG,1533
VINTAGE BILLBOARD LOVE/HATE MUG,3044
WOOD 2 DRAWER CABINET WHITE FINISH,3531
WOOD S/3 CABINET ANT WHITE FINISH,4429
WOODEN PICTURE FRAME WHITE FINISH,3530
WOODEN FRAME ANTIQUE WHITE ,5144
KNITTED UNION FLAG HOT WATER BOTTLE,4318
RED WOOLLY HOTTIE WHITE HEART.,2155
SET 7 BABUSHKA NESTING BOXES,6487
GLASS STAR FROSTED T-LIGHT HOLDER,3544
HOT WATER BOTTLE TEA AND SYMPATHY,6419
RED HANGING HEART T-LIGHT HOLDER,2587
HAND WARMER RED POLKA DOT,5911
HAND WARMER UNION JACK,6377
JUMBO BAG PINK POLKADOT,3589
JUMBO  BAG BAROQUE BLACK WHITE,2408
JUMBO BAG CHARLIE AND LOLA TOYS,1647
STRAWBERRY CHARLOTTE BAG,3106
RED 3 PIECE RETROSPOT CUTLERY SET,4644
BLUE 3 PIECE POLKADOT CUTLERY SET,2697
SET/6 RED SPOTTY PAPER PLATES,2769
LUNCH BAG RED RETROSPOT,4440
STRAWBERRY LUNCH BOX WITH CUTLERY,5038
LUNCH BOX WITH CUTLERY RETROSPOT ,1754
PACK OF 72 RETROSPOT CAKE CASES,2402
PACK OF 60 DINOSAUR CAKE CASES,2493
PACK OF 60 PINK PAISLEY CAKE CASES,4232
60 TEATIME FAIRY CAKE CASES,5508
TOMATO CHARLIE+LOLA COASTER SET,3698
CHARLIE & LOLA WASTEPAPER BIN FLORA,6699
RED CHARLIE+LOLA PERSONAL DOORSIGN,1240
JUMBO STORAGE BAG SUKI,3411
JUMBO BAG PINK VINTAGE PAISLEY,1007
JAM MAKING SET PRINTED,2645
RETROSPOT TEA SET CERAMIC 11 PC ,5038
GIRLY PINK TOOL SET,2866
JUMBO SHOPPER VINTAGE RED PAISLEY,6302
"AIRLINE LOUNGE,METAL SIGN",1736
WHITE SPOT RED CERAMIC DRAWER KNOB,6958
RED DRAWER KNOB ACRYLIC EDWARDIAN,2886
CLEAR DRAWER KNOB ACRYLIC EDWARDIAN,5767
PHOTO CLIP LINE,3606
FELT EGG COSY CHICKEN,6739
PIGGY BANK RETROSPOT ,6378
SKULL SHOULDER BAG,2701
YOU'RE CONFUSING ME METAL SIGN ,2295
COOK WITH WINE METAL SIGN ,2430
GIN + TONIC DIET METAL SIGN,3353
YELLOW BREAKFAST CUP AND SAUCER,4450
PINK BREAKFAST CUP AND SAUCER ,3154
PAPER CHAIN KIT 50'S CHRISTMAS ,4429
PAPER CHAIN KIT RETROSPOT,3934
SMALL HEART FLOWERS HOOK ,6541
PHOTO CLIP LINE,2779
TEA TIME DES TEA COSY,3203
FELT EGG COSY WHITE RABBIT ,3619
ZINC WILLIE WINKIE  CANDLE STICK,3930
CERAMIC CHERRY CAKE MONEY BANK,2976
RETROSPOT LARGE MILK JUG,2592
SET OF 6 FUNKY BEAKERS,1168
EDWARDIAN PARASOL BLACK,3151
EDWARDIAN PARASOL NATURAL,6744
CERAMIC STRAWBERRY CAKE MONEY BANK,6611
BLUE OWL SOFT TOY,3132
BALLOON ART MAKE YOUR OWN FLOWERS,1602
RED TOADSTOOL LED NIGHT LIGHT,2743
GLASS CLOCHE SMALL,3649
GUMBALL MONOCHROME COAT RACK,4094
DOORMAT FANCY FONT HOME SWEET HOME,2571
Discount,5758
INFLATABLE POLITICAL GLOBE ,3555
VINTAGE SNAKES & LADDERS,4497
CHOCOLATE CALCULATOR,6917
JUMBO SHOPPER VINTAGE RED PAISLEY,6151
RECYCLING BAG RETROSPOT ,5600
TOY TIDY PINK POLKADOT,5077
ANTIQUE GLASS DRESSING TABLE POT,5331
ALARM CLOCK BAKELIKE GREEN,1993
IVORY GIANT GARDEN THERMOMETER,2189
3 TIER CAKE TIN GREEN AND CREAM,5669
3 TIER CAKE TIN RED AND CREAM,5003
SET 3 WICKER OVAL BASKETS W LIDS,6162
SET OF 3 COLOURED  FLYING DUCKS,5703
WOOD BLACK BOARD ANT WHITE FINISH,3551
COLOUR GLASS T-LIGHT HOLDER HANGING,6860
HANGING METAL HEART LANTERN,1420
HANGING MEDINA LANTERN SMALL,3355
NATURAL SLATE HEART CHALKBOARD ,4781
HEART OF WICKER SMALL,2186
HEART OF WICKER LARGE,3409
WHITE LOVEBIRD LANTERN,3943
CLASSIC METAL BIRDCAGE PLANT HOLDER,4594
CREAM HEART CARD HOLDER,4528
ENAMEL FLOWER JUG CREAM,6744
ENAMEL FIRE BUCKET CREAM,4531
ENAMEL BREAD BIN CREAM,2548
SET 3 WICKER OVAL BASKETS W LIDS,1904
JAM MAKING SET PRINTED,6616
JAM MAKING SET WITH JARS,4860
JUMBO BAG DOLLY GIRL DESIGN,3575
TRADITIONAL CHRISTMAS RIBBONS,1778
ORGANISER WOOD ANTIQUE WHITE ,1746
LUNCH BAG DOLLY GIRL DESIGN,5398
WHITE WIRE EGG HOLDER,6619
JUMBO  BAG BAROQUE BLACK WHITE,1427
JUMBO BAG RED RETROSPOT,3751
CHILLI LIGHTS,2569
LIGHT GARLAND BUTTERFILES PINK,1773
WOODEN OWLS LIGHT GARLAND ,3470
FAIRY TALE COTTAGE NIGHTLIGHT,4518
RED TOADSTOOL LED NIGHT LIGHT,4035
HOME BUILDING BLOCK WORD,1888
LOVE BUILDING BLOCK WORD,6775
DOORMAT FANCY FONT HOME SWEET HOME,3991
HOME SMALL WOOD LETTERS,1061
GINGHAM HEART  DOORSTOP RED,4192
FIVE HEART HANGING DECORATION,2299
HANGING METAL HEART LANTERN,1758
ASSORTED BOTTLE TOP  MAGNETS ,1090
FRIDGE MAGNETS US DINER ASSORTED,3171
HOMEMADE JAM SCENTED CANDLES,5082
FRIDGE MAGNETS LES ENFANTS ASSORTED,1843
ROSE CARAVAN DOORSTOP,5096
HEART OF WICKER SMALL,1755
5 HOOK HANGER MAGIC TOADSTOOL,1223
CHRISTMAS LIGHTS 10 REINDEER,2027
VINTAGE UNION JACK CUSHION COVER,2653
VINTAGE HEADS AND TAILS CARD GAME ,6089
SET OF 3 COLOURED  FLYING DUCKS,6633
SET OF 3 GOLD FLYING DUCKS,2604
RED RETROSPOT UMBRELLA,5163
BLACK/BLUE POLKADOT UMBRELLA,5178
RED DINER WALL CLOCK,5890
ALARM CLOCK BAKELIKE GREEN,1170
ALARM CLOCK BAKELIKE RED ,6427
BLUE DINER WALL CLOCK,4024
IVORY DINER WALL CLOCK,1964
LARGE HEART MEASURING SPOONS,5285
SMALL HEART MEASURING SPOONS,2870
CHRISTMAS LIGHTS 10 REINDEER,4492
JAM MAKING SET WITH JARS,6299
JAM MAKING SET PRINTED,2014
JAM JAR WITH PINK LID,3075
JAM JAR WITH GREEN LID,2863
ROSE COTTAGE KEEPSAKE BOX ,3211
HANGING HEART ZINC T-LIGHT HOLDER,6163
PAPER CHAIN KIT VINTAGE CHRISTMAS,6149
DISCO BALL CHRISTMAS DECORATION,2099
WHITE HANGING HEART T-LIGHT HOLDER,6040
SMALL POPCORN HOLDER,2625
LARGE POPCORN HOLDER ,5863
RETROSPOT LARGE MILK JUG,2707
SET/20 RED RETROSPOT PAPER NAPKINS ,1685
SET/6 RED SPOTTY PAPER PLATES,1601
SET/6 RED SPOTTY PAPER CUPS,3789
POLKADOT RAIN HAT ,1620
DELUXE SEWING KIT ,1764
RETROSPOT HEART HOT WATER BOTTLE,3915
KNITTED UNION FLAG HOT WATER BOTTLE,4674
ENGLISH ROSE HOT WATER BOTTLE,6241
PHOTO CUBE,4699
HOMEMADE JAM SCENTED CANDLES,1505
JUMBO BAG RED RETROSPOT,5596
PLASTERS IN TIN CIRCUS PARADE ,6850
PACK OF 12 PINK PAISLEY TISSUES ,2452
PACK OF 12 BLUE PAISLEY TISSUES ,3557
PACK OF 12 RED RETROSPOT TISSUES ,5285
CHICK GREY HOT WATER BOTTLE,2419
PLASTERS IN TIN VINTAGE PAISLEY ,2972
PLASTERS IN TIN SKULLS,2797
3 STRIPEY MICE FELTCRAFT,4788
SET OF 6 SOLDIER SKITTLES,1502
TRADITIONAL WOODEN SKIPPING ROPE,1060
WOODEN BOX OF DOMINOES,6883
RUSTIC  SEVENTEEN DRAWER SIDEBOARD,5449
PARTY CONES CARNIVAL ASSORTED,5341
PARTY CONES CANDY ASSORTED,5564
PICNIC BASKET WICKER SMALL,4452
ASSORTED COLOUR BIRD ORNAMENT,2154
STAR DECORATION PAINTED ZINC ,3103
RETROSPOT LAMP,6846
"FANCY FONT BIRTHDAY CARD, ",2513
HAND WARMER UNION JACK,3276
HAND WARMER SCOTTY DOG DESIGN,5506
HAND WARMER OWL DESIGN,4825
HAND WARMER RED RETROSPOT,3217
RETROSPOT HEART HOT WATER BOTTLE,4866
DOG BOWL CHASING BALL DESIGN,3975
CLOTHES PEGS RETROSPOT PACK 24 ,1000
HAND OVER THE CHOCOLATE   SIGN ,1582
WHITE HANGING HEART T-LIGHT HOLDER,5996
TRAVEL SEWING KIT,6497
BLACK HEART CARD HOLDER,4359
ASSORTED COLOUR BIRD ORNAMENT,5521
PACK OF 60 PINK PAISLEY CAKE CASES,3907
60 TEATIME FAIRY CAKE CASES,4571
PACK OF 72 RETROSPOT CAKE CASES,3563
CHICK GREY HOT WATER BOTTLE,1221
SMALL GLASS HEART TRINKET POT,2057
ALARM CLOCK BAKELIKE IVORY,4498
ALARM CLOCK BAKELIKE RED ,4246
ALARM CLOCK BAKELIKE ORANGE,5021
ALARM CLOCK BAKELIKE GREEN,2437
HOT WATER BOTTLE TEA AND SYMPATHY,2233
HAND WARMER BIRD DESIGN,2356
HAND WARMER SCOTTY DOG DESIGN,5509
WHITE HANGING HEART T-LIGHT HOLDER,4681
WHITE METAL LANTERN,1367
CREAM CUPID HEARTS COAT HANGER,1046
EDWARDIAN PARASOL BLACK,3696
EDWARDIAN PARASOL RED,1617
RETRO COFFEE MUGS ASSORTED,5541
SAVE THE PLANET MUG,2160
VINTAGE BILLBOARD DRINK ME MUG,2908
VINTAGE BILLBOARD LOVE/HATE MUG,2136
WOOD 2 DRAWER CABINET WHITE FINISH,2121
WOOD S/3 CABINET ANT WHITE FINISH,4615
WOODEN PICTURE FRAME WHITE FINISH,3366
WOODEN FRAME ANTIQUE WHITE ,3650
KNITTED UNION FLAG HOT WATER BOTTLE,4080
RED WOOLLY HOTTIE WHITE HEART.,4951
SET 7 BABUSHKA NESTING BOXES,4540
IVORY EMBROIDERED QUILT ,4247
GLASS STAR FROSTED T-LIGHT HOLDER,1298
SET OF 3 BLACK FLYING DUCKS,6058
SET OF 3 COLOURED  FLYING DUCKS,2474
PACK OF 12 RED RETROSPOT TISSUES ,5668
RED RETROSPOT MUG,6766
BABUSHKA LIGHTS STRING OF 10,6839
PIGGY BANK RETROSPOT ,6984
SET 7 BABUSHKA NESTING BOXES,1590
DOORMAT FAIRY CAKE,3015
HAND WARMER RED RETROSPOT,6401
HAND WARMER SCOTTY DOG DESIGN,2812
HAND WARMER OWL DESIGN,6285
STRAWBERRY CERAMIC TRINKET BOX,3861
PINK DOUGHNUT TRINKET POT ,4382
SILK PURSE BABUSHKA PINK,5412
HOT WATER BOTTLE TEA AND SYMPATHY,2701
HOT WATER BOTTLE I AM SO POORLY,4057
CHOCOLATE HOT WATER BOTTLE,6827
WHITE SKULL HOT WATER BOTTLE ,4045
SCOTTIE DOG HOT WATER BOTTLE,5322
HAND WARMER RED POLKA DOT,1148
HAND WARMER UNION JACK,3721
HOMEMADE JAM SCENTED CANDLES,1677
BIRD HOUSE HOT WATER BOTTLE,3679
BOUDOIR SQUARE TISSUE BOX,6739
SKULLS SQUARE TISSUE BOX,6436
PHOTO FRAME CORNICE,1441
SILK PURSE BABUSHKA RED,5469
PICTURE DOMINOES,6844
S/6 SEW ON CROCHET FLOWERS,6602
SCANDINAVIAN REDS RIBBONS,2706
BALLOONS  WRITING SET ,6484
JAM MAKING SET PRINTED,3817
LAVENDER INCENSE IN TIN,3640
TV DINNER TRAY VINTAGE PAISLEY,2016
SET OF 4 ENGLISH ROSE PLACEMATS,2408
SET OF 4 ENGLISH ROSE COASTERS,3770
TRIPLE PHOTO FRAME CORNICE ,4017
FAMILY PHOTO FRAME CORNICE,1507
MIRRORED DISCO BALL ,3186
DISCO BALL ROTATOR BATTERY OPERATED,5724
SILVER LOOKING MIRROR,3761
LADIES & GENTLEMEN METAL SIGN,1176
METAL SIGN HER DINNER IS SERVED ,4858
YOU'RE CONFUSING ME METAL SIGN ,4207
DOORMAT TOPIARY,6191
BATHROOM METAL SIGN,1632
KITCHEN METAL SIGN,5298
TOILET METAL SIGN,5185
METAL SIGN TAKE IT OR LEAVE IT ,5904
I'M ON HOLIDAY METAL SIGN,5190
GROW YOUR OWN BASIL IN ENAMEL MUG,6604
SET/10 PINK POLKADOT PARTY CANDLES,2646
SET 20 NAPKINS FAIRY CAKES DESIGN ,4490
60 TEATIME FAIRY CAKE CASES,1912
SET OF 6 T-LIGHTS SNOWMEN,4145
SET OF 6 T-LIGHTS SANTA,5687
SET OF 9 HEART SHAPED BALLOONS,3401
SANDWICH BATH SPONGE,6294
APPLE BATH SPONGE,3938
STRAWBERRY BATH SPONGE ,6169
BLACK PIRATE TREASURE CHEST,3521
STAR PORTABLE TABLE LIGHT ,1652
SNOWFLAKE PORTABLE TABLE LIGHT ,2325
PINK OVAL JEWELLED MIRROR,4472
RETROSPOT CIGAR BOX MATCHES ,6293
COSY HOUR GIANT TUBE MATCHES,4654
JAZZ HEARTS PURSE NOTEBOOK,4651
LUNCH BAG DOLLY GIRL DESIGN,4250
WHITE HANGING HEART T-LIGHT HOLDER,5469
CANDLEHOLDER PINK HANGING HEART,2326
WOOD 2 DRAWER CABINET WHITE FINISH,5112
ASSORTED COLOUR MINI CASES,3161
LUNCH BAG RED RETROSPOT,1748
LUNCH BAG SPACEBOY DESIGN ,2778
LUNCH BAG WOODLAND,1104
LUNCH BAG PINK POLKADOT,6514
GUMBALL COAT RACK,1132
BLUE NEW BAROQUE CANDLESTICK CANDLE,5447
PINK NEW BAROQUECANDLESTICK CANDLE,3074
FAIRY CAKE FLANNEL ASSORTED COLOUR,1872
BREAD BIN DINER STYLE PINK,5763
JUMBO BAG CHARLIE AND LOLA TOYS,6393
TEA TIME TABLE CLOTH,6626
ENGLISH ROSE HOT WATER BOTTLE,5465
ENAMEL FIRE BUCKET CREAM,6880
PICNIC BASKET WICKER SMALL,6858
PAPER CHAIN KIT 50'S CHRISTMAS ,3360
PAPER CHAIN KIT VINTAGE CHRISTMAS,4910
HOT WATER BOTTLE BABUSHKA ,2758
HAND WARMER BIRD DESIGN,5536
POSTAGE,3894
HEART IVORY TRELLIS SMALL,5748
CLEAR DRAWER KNOB ACRYLIC EDWARDIAN,6853
PINK DRAWER KNOB ACRYLIC EDWARDIAN,3382
GREEN DRAWER KNOB ACRYLIC EDWARDIAN,3765
BLUE DRAWER KNOB ACRYLIC EDWARDIAN,2218
HEART OF WICKER SMALL,3843
SMALL POPCORN HOLDER,4352
SET 6 FOOTBALL CELEBRATION CANDLES,5509
SET OF 6 GIRLS CELEBRATION CANDLES,2161
ROMANTIC PINKS RIBBONS ,1635
BRIGHT BLUES RIBBONS ,2680
SCANDINAVIAN REDS RIBBONS,5718
CHOCOLATE BOX RIBBONS ,1129
PARTY INVITES FOOTBALL,3324
PARTY INVITES JAZZ HEARTS,5151
PARTY INVITES SPACEMAN,3134
SET OF 3 BUTTERFLY COOKIE CUTTERS,2605
SET OF 3 HEART COOKIE CUTTERS,4291
3 PIECE SPACEBOY COOKIE CUTTER SET,6757
PACK OF 72 SKULL CAKE CASES,3464
PACK OF 60 SPACEBOY CAKE CASES,3362
PACK OF 72 RETROSPOT CAKE CASES,4541
72 SWEETHEART FAIRY CAKE CASES,6004
PACK OF 60 DINOSAUR CAKE CASES,1287
LUNCH BAG SUKI  DESIGN ,3966
LUNCH BAG CARS BLUE,2899
LUNCH BAG  BLACK SKULL.,5388
HEART IVORY TRELLIS LARGE,6781
SET/5 RED RETROSPOT LID GLASS BOWLS,1764
WHITE HANGING HEART T-LIGHT HOLDER,5927
WHITE METAL LANTERN,5262
CREAM CUPID HEARTS COAT HANGER,1556
EDWARDIAN PARASOL RED,3977
RETRO COFFEE MUGS ASSORTED,6432
SAVE THE PLANET MUG,1189
VINTAGE BILLBOARD DRINK ME MUG,6131
VINTAGE BILLBOARD LOVE/HATE MUG,6533
WOOD 2 DRAWER CABINET WHITE FINISH,6714
WOOD S/3 CABINET ANT WHITE FINISH,1549
WOODEN PICTURE FRAME WHITE FINISH,2613
WOODEN FRAME ANTIQUE WHITE ,1177
KNITTED UNION FLAG HOT WATER BOTTLE,3370
RED WOOLLY HOTTIE WHITE HEART.,3660
SET 7 BABUSHKA NESTING BOXES,3383
IVORY EMBROIDERED QUILT ,2000
GLASS STAR FROSTED T-LIGHT HOLDER,3759
HAND WARMER RED POLKA DOT,6705
HAND WARMER UNION JACK,1834
MAGIC DRAWING SLATE DINOSAUR,4517
MAGIC DRAWING SLATE BAKE A CAKE ,2890
12 PENCILS TALL TUBE SKULLS,2712
CHOCOLATE CALCULATOR,3869
RED  HARMONICA IN BOX ,3031
BLUE HARMONICA IN BOX ,5887
SKULLS  WATER TRANSFER TATTOOS ,5279
PACK 3 BOXES BIRD PANNETONE ,4310
HOT WATER BOTTLE TEA AND SYMPATHY,3745
RED WOOLLY HOTTIE WHITE HEART.,3500
WHITE SKULL HOT WATER BOTTLE ,1777
3 PIECE SPACEBOY COOKIE CUTTER SET,1149
SET OF 20 KIDS COOKIE CUTTERS,6827
10 COLOUR SPACEBOY PEN,4192
VICTORIAN GLASS HANGING T-LIGHT,5661
SINGLE HEART ZINC T-LIGHT HOLDER,1391
RED HANGING HEART T-LIGHT HOLDER,6101
HANGING METAL STAR LANTERN,2263
SILVER HANGING T-LIGHT HOLDER,1319
DOORMAT RED RETROSPOT,6850
DOORMAT HEARTS,2336
NATURAL SLATE RECTANGLE CHALKBOARD,2854
LOVEBIRD HANGING DECORATION WHITE ,2473
ASSORTED COLOUR BIRD ORNAMENT,1473
HOME BUILDING BLOCK WORD,1915
LOVE BUILDING BLOCK WORD,6029
PHOTO FRAME CORNICE,3005
PENS ASSORTED FUNNY FACE,5375
CARD CIRCUS PARADE,4468
WRAP COWBOYS  ,5945
AIRLINE BAG VINTAGE TOKYO 78,5107
RED RETROSPOT UMBRELLA,5637
BLACK/BLUE POLKADOT UMBRELLA,4835
RED 3 PIECE RETROSPOT CUTLERY SET,1983
PACK OF 72 RETROSPOT CAKE CASES,6607
SET OF 72 RETROSPOT PAPER  DOILIES,5391
BLUE COAT RACK PARIS FASHION,1768
PLASTERS IN TIN SKULLS,4266
SLEEPING CAT ERASERS,3034
CARD BIRTHDAY COWBOY,4451
PACK 3 BOXES CHRISTMAS PANNETONE,5511
ROTATING SILVER ANGELS T-LIGHT HLDR,1769
COSY HOUR GIANT TUBE MATCHES,2216
RIBBON REEL MAKING SNOWMEN ,1800
MINI PAINT SET VINTAGE ,3229
4 TRADITIONAL SPINNING TOPS,3820
SET OF 6 SOLDIER SKITTLES,4562
BAG 500g SWIRLY MARBLES,6722
5 STRAND GLASS NECKLACE CRYSTAL,5815
WHITE SKULL HOT WATER BOTTLE ,5507
SCOTTIE DOG HOT WATER BOTTLE,3494
SQUARECUSHION COVER PINK UNION FLAG,4337
SPACEBOY CHILDRENS EGG CUP,6396
CHILDREN'S SPACEBOY MUG,3318
HAND WARMER SCOTTY DOG DESIGN,1303
FELTCRAFT CUSHION OWL,1865
BLACK CANDELABRA T-LIGHT HOLDER,2610
TOY TIDY DOLLY GIRL DESIGN,1706
SET 12 LAVENDER  BOTANICAL T-LIGHTS,3578
UNION JACK FLAG LUGGAGE TAG,5852
RED HEART LUGGAGE TAG,6638
RED GLASS TASSLE BAG CHARM,2552
CLEAR ACRYLIC FACETED BANGLE,4259
5 STRAND GLASS NECKLACE CRYSTAL,3271
DOORMAT UNION JACK GUNS AND ROSES,5774
VANILLA SCENT CANDLE JEWELLED BOX,5974
FULL ENGLISH BREAKFAST PLATE,2931
BLACK CANDELABRA T-LIGHT HOLDER,3156
MAGIC DRAWING SLATE CIRCUS PARADE  ,4353
CHRISTMAS HANGING HEART WITH BELL,2176
CAKE STAND VICTORIAN FILIGREE MED,1020
PAISLEY PATTERN  STICKERS,5552
FLOWERS  STICKERS,5880
PINK NEW BAROQUECANDLESTICK CANDLE,3102
BLUE NEW BAROQUE CANDLESTICK CANDLE,6961
JUMBO STORAGE BAG SUKI,6440
BLACK LOVE BIRD CANDLE,2537
PARTY TIME PENCIL ERASERS,1385
DISCO BALL CHRISTMAS DECORATION,6621
PINK B'FLY C/COVER W BOBBLES,5347
PINK UNION JACK  LUGGAGE TAG,1682
6 RIBBONS ELEGANT CHRISTMAS ,5030
UNION JACK FLAG LUGGAGE TAG,5331
AGED GLASS SILVER T-LIGHT HOLDER,3252
BOOM BOX SPEAKER GIRLS,5615
6 RIBBONS SHIMMERING PINKS ,1348
 SET 2 TEA TOWELS I LOVE LONDON ,4349
JUMBO BAG OWLS,2215
SANDWICH BATH SPONGE,5723
OWL DOORSTOP,2318
5 STRAND GLASS NECKLACE CRYSTAL,5076
HAND WARMER UNION JACK,1405
HAND WARMER SCOTTY DOG DESIGN,3203
LARGE POPCORN HOLDER ,5643
PAINTED METAL STAR WITH HOLLY BELLS,5737
PAINTED METAL HEART WITH HOLLY BELL,4362
ANGEL DECORATION STARS ON DRESS,6570
SMALL POPCORN HOLDER,5496
JUMBO BAG RED RETROSPOT,2902
JUMBO BAG STRAWBERRY,5890
STRAWBERRY SHOPPER BAG,1620
STRAWBERRY CHARLOTTE BAG,4961
 SET 2 TEA TOWELS I LOVE LONDON ,4332
PACK OF 12 RED RETROSPOT TISSUES ,2282
SCOTTIE DOG HOT WATER BOTTLE,6859
CHOCOLATE HOT WATER BOTTLE,2429
LUNCH BAG CARS BLUE,3978
LUNCH BAG SPACEBOY DESIGN ,5772
ROUND SNACK BOXES SET OF4 WOODLAND ,4219
LUNCH BAG DOLLY GIRL DESIGN,4882
LUNCH BAG SUKI  DESIGN ,6718
LUNCH BAG  BLACK SKULL.,3123
ROUND SNACK BOXES SET OF 4 FRUITS ,4098
ROUND SNACK BOXES SET OF 4 SKULLS,3470
DOLLY GIRL LUNCH BOX,5414
SPACEBOY LUNCH BOX ,2541
GREEN POLKADOT PLATE ,4093
BLUE POLKADOT PLATE ,5587
RED RETROSPOT PLATE ,5517
PINK  POLKADOT PLATE ,4924
ROUND SNACK BOXES SET OF 4 SKULLS,1229
FELTCRAFT DOLL MOLLY,6839
FELTCRAFT CHRISTMAS FAIRY,5919
TRAVEL SEWING KIT,1660
SET OF 3 NOTEBOOKS IN PARCEL,4932
RED RETROSPOT TAPE,2820
COSY SLIPPER SHOES SMALL  RED ,1255
6 RIBBONS RUSTIC CHARM,6011
SCANDINAVIAN REDS RIBBONS,2986
JAM MAKING SET PRINTED,5814
12 DAISY PEGS IN WOOD BOX,6281
HOT WATER BOTTLE BABUSHKA ,1115
FELTCRAFT PRINCESS CHARLOTTE DOLL,3670
FELTCRAFT CHRISTMAS FAIRY,2764
FELTCRAFT PRINCESS CHARLOTTE DOLL,6117
6 RIBBONS RUSTIC CHARM,1179
COSY SLIPPER SHOES SMALL  RED ,1159
SCANDINAVIAN REDS RIBBONS,2166
5 HOOK HANGER RED MAGIC TOADSTOOL,4541
CHRISTMAS CRAFT TREE TOP ANGEL,5279
CHRISTMAS CRAFT LITTLE FRIENDS,3875
5 HOOK HANGER RED MAGIC TOADSTOOL,1956
6 RIBBONS RUSTIC CHARM,6312
12 DAISY PEGS IN WOOD BOX,6453
SET OF 3 NOTEBOOKS IN PARCEL,2800
5 HOOK HANGER MAGIC TOADSTOOL,2993
SCANDINAVIAN REDS RIBBONS,1995
RED TOADSTOOL LED NIGHT LIGHT,5178
5 HOOK HANGER RED MAGIC TOADSTOOL,3063
COSY SLIPPER SHOES SMALL GREEN,5898
COSY SLIPPER SHOES SMALL  RED ,1386
FELTCRAFT DOLL ROSIE,4325
FELTCRAFT DOLL MOLLY,3492
FELTCRAFT DOLL EMILY,6604
FELTCRAFT PRINCESS CHARLOTTE DOLL,5898
FELTCRAFT PRINCESS OLIVIA DOLL,2453
REX CASH+CARRY JUMBO SHOPPER,5307
FELTCRAFT DOLL MOLLY,1278
FELTCRAFT CUSHION OWL,5124
CHRISTMAS CRAFT TREE TOP ANGEL,2748
CHRISTMAS CRAFT LITTLE FRIENDS,4309
FELTCRAFT CUSHION RABBIT,3532
FELTCRAFT CUSHION BUTTERFLY,6652
12 DAISY PEGS IN WOOD BOX,2584
PAPER CHAIN KIT 50'S CHRISTMAS ,5866
FELTCRAFT CUSHION BUTTERFLY,4827
12 DAISY PEGS IN WOOD BOX,5925
ROSE COTTAGE KEEPSAKE BOX ,2645
TOTE BAG I LOVE LONDON,1189
12 DAISY PEGS IN WOOD BOX,2985
TOTE BAG I LOVE LONDON,6676
FOLDING UMBRELLA PINKWHITE POLKADOT,4012
FOLDING UMBRELLA CREAM POLKADOT,4510
FOLDING UMBRELLA WHITE/RED POLKADOT,2909
SET 10 LIGHTS NIGHT OWL,1788
SMALL POPCORN HOLDER,2710
 SET 2 TEA TOWELS I LOVE LONDON ,4503
FOLDING UMBRELLA RED/WHITE POLKADOT,3194
BABUSHKA LIGHTS STRING OF 10,2986
LUNCH BAG RED RETROSPOT,6722
S/4 VALENTINE DECOUPAGE HEART BOX,5279
FOLDING UMBRELLA CREAM POLKADOT,5378
 SET 2 TEA TOWELS I LOVE LONDON ,4094
FOLDING UMBRELLA RED/WHITE POLKADOT,4951
SOLDIERS EGG CUP ,5200
S/4 VALENTINE DECOUPAGE HEART BOX,3480
RED RETROSPOT MINI CASES,2256
FELTCRAFT BUTTERFLY HEARTS,1343
60 CAKE CASES VINTAGE CHRISTMAS,1200
PAPER CHAIN KIT VINTAGE CHRISTMAS,6005
RIBBON REEL CHRISTMAS SOCK BAUBLE,2943
RIBBON REEL SNOWY VILLAGE,5245
RIBBON REEL MAKING SNOWMEN ,2855
SET OF 20 VINTAGE CHRISTMAS NAPKINS,1668
TURQUOISE CHRISTMAS TREE ,3325
RED STAR CARD HOLDER,4775
WICKER WREATH SMALL,5623
HEART OF WICKER LARGE,5960
ADVENT CALENDAR GINGHAM SACK,6744
HEART OF WICKER SMALL,2472
FELTCRAFT BUTTERFLY HEARTS,3817
PARTY CONE CHRISTMAS DECORATION ,3686
VINTAGE HEADS AND TAILS CARD GAME ,1648
WICKER STAR ,1781
VINTAGE SNAP CARDS,4256
FELTCRAFT 6 FLOWER FRIENDS,5971
 SET 2 TEA TOWELS I LOVE LONDON ,5052
JAM MAKING SET PRINTED,5161
BIRD DECORATION RED RETROSPOT,2717
CHRISTMAS GINGHAM TREE,4193
CHRISTMAS GINGHAM STAR,5475
CHRISTMAS GINGHAM HEART,2354
PACK OF 12 PINK POLKADOT TISSUES,5575
FELTCRAFT PRINCESS LOLA DOLL,1968
PACK OF 12 LONDON TISSUES ,6630
PURPLE DRAWERKNOB ACRYLIC EDWARDIAN,5655
CHILDREN'S APRON DOLLY GIRL ,3584
CHILDRENS APRON SPACEBOY DESIGN,1801
CHRISTMAS LIGHTS 10 SANTAS ,3273
CHRISTMAS LIGHTS 10 REINDEER,4953
PAPER CHAIN KIT 50'S CHRISTMAS ,5712
FELTCRAFT CHRISTMAS FAIRY,6875
PACK OF 72 RETROSPOT CAKE CASES,1536
PACK OF 60 MUSHROOM CAKE CASES,1137
60 CAKE CASES DOLLY GIRL DESIGN,6387
PACK OF 60 PINK PAISLEY CAKE CASES,2888
HAND WARMER BABUSHKA DESIGN,1502
HAND WARMER BIRD DESIGN,1296
HAND WARMER OWL DESIGN,3553
HAND WARMER RED RETROSPOT,2700
SET 12 RETRO WHITE CHALK STICKS,6626
FELTCRAFT HAIRBAND RED AND BLUE,4479
FELTCRAFT HAIRBAND PINK AND PURPLE,4452
FELTCRAFT HAIRBANDS PINK AND WHITE ,1919
TV DINNER TRAY DOLLY GIRL,2207
PLASTERS IN TIN VINTAGE PAISLEY ,4001
PLASTERS IN TIN SPACEBOY,2559
PLASTERS IN TIN WOODLAND ANIMALS,3315
MAGIC DRAWING SLATE SPACEBOY ,2807
MAGIC DRAWING SLATE CIRCUS PARADE  ,5110
MAGIC DRAWING SLATE GO TO THE FAIR ,5420
MAGIC DRAWING SLATE DOLLY GIRL ,3677
CHARLIE + LOLA RED HOT WATER BOTTLE,5356
HOT WATER BOTTLE BABUSHKA ,4002
URBAN BLACK RIBBONS ,3618
FELTCRAFT PRINCESS CHARLOTTE DOLL,3319
SET OF 6 T-LIGHTS TOADSTOOLS,5670
ROTATING LEAVES T-LIGHT HOLDER,1166
RED  HARMONICA IN BOX ,6404
CUPCAKE LACE PAPER SET 6,6580
FAMILY PHOTO FRAME CORNICE,2148
TRIPLE PHOTO FRAME CORNICE ,5430
WOODEN FRAME ANTIQUE WHITE ,1431
WOODEN BOX OF DOMINOES,6053
TRADITIONAL WOODEN CATCH CUP GAME ,1640
TRADITIONAL WOODEN SKIPPING ROPE,6093
S/6 WOODEN SKITTLES IN COTTON BAG,1344
RED METAL BEACH SPADE ,6276
BOYS VINTAGE TIN SEASIDE BUCKET,6159
GIRLS VINTAGE TIN SEASIDE BUCKET,3566
GREY HEART HOT WATER BOTTLE,6124
SCOTTIE DOG HOT WATER BOTTLE,1575
BIRD HOUSE HOT WATER BOTTLE,3689
KINGS CHOICE TEA CADDY ,1085
KINGS CHOICE BISCUIT TIN,3057
METAL SIGN EMPIRE TEA,2877
HOMEMADE JAM SCENTED CANDLES,3001
SET OF 6 SOLDIER SKITTLES,1904
FAWN BLUE HOT WATER BOTTLE,1977
HAND WARMER RED RETROSPOT,3246
HOT WATER BOTTLE BABUSHKA ,5517
WHITE SKULL HOT WATER BOTTLE ,5460
RETROSPOT HEART HOT WATER BOTTLE,3522
RED WOOLLY HOTTIE WHITE HEART.,5199
SCOTTIE DOG HOT WATER BOTTLE,1780
GREY HEART HOT WATER BOTTLE,3784
HOT WATER BOTTLE BABUSHKA ,3533
PACK OF 6 BIRDY GIFT TAGS,2772
CHILLI LIGHTS,4210
PIGGY BANK RETROSPOT ,1959
CERAMIC STRAWBERRY MONEY BOX,4050
CERAMIC STRAWBERRY CAKE MONEY BANK,5268
CERAMIC CHERRY CAKE MONEY BANK,5745
CERAMIC HEART FAIRY CAKE MONEY BANK,4322
CERAMIC PIRATE CHEST MONEY BANK,1373
DOORSTOP RETROSPOT HEART,2750
GINGHAM HEART  DOORSTOP RED,3353
RETROSPOT BABUSHKA DOORSTOP,4422
SILK PURSE BABUSHKA RED,1136
SILK PURSE BABUSHKA PINK,4501
FAMILY PHOTO FRAME CORNICE,4786
SWEETHEART WIRE WALL TIDY,1107
JAM MAKING SET PRINTED,6598
RED RETROSPOT OVEN GLOVE ,1996
CREAM HEART CARD HOLDER,2792
NAMASTE SWAGAT INCENSE,2822
CERAMIC STRAWBERRY DESIGN MUG,4082
BLACK HEART CARD HOLDER,6916
CLASSICAL ROSE SMALL VASE,2378
HYACINTH BULB T-LIGHT CANDLES,4546
CHRISTMAS CRAFT WHITE FAIRY ,2042
CHRISTMAS CRAFT LITTLE FRIENDS,1535
COSY HOUR CIGAR BOX MATCHES ,5695
RED TEA TOWEL CLASSIC DESIGN,2257
HEART FILIGREE DOVE  SMALL,5171
RETROSPOT CHILDRENS APRON,3453
COLOURING PENCILS BROWN TUBE,4844
4 IVORY DINNER CANDLES SILVER FLOCK,5561
HEART FILIGREE DOVE  SMALL,2731
ZINC METAL HEART DECORATION,3100
GREEN FERN NOTEBOOK,4884
BLUE PAISLEY NOTEBOOK,5367
CHRYSANTHEMUM NOTEBOOK,6556
LARGE CHINESE STYLE SCISSOR,2635
SMALL CHINESE STYLE SCISSOR,3955
S/6 WOODEN SKITTLES IN COTTON BAG,2092
TRADITIONAL WOODEN SKIPPING ROPE,6780
SET OF 6 SOLDIER SKITTLES,1248
4 TRADITIONAL SPINNING TOPS,5286
ROTATING SILVER ANGELS T-LIGHT HLDR,3801
BLACK LOVE BIRD CANDLE,2921
RETROSPOT CHILDRENS APRON,4062
HANGING GLASS ETCHED TEALIGHT,3995
HANGING GLASS ETCHED TEALIGHT,6839
BLUE NEW BAROQUE CANDLESTICK CANDLE,4779
COOKING SET RETROSPOT,6975
KINGS CHOICE GIANT TUBE MATCHES,5058
COSY HOUR GIANT TUBE MATCHES,5841
