ProductName,Price
CHILDS GARDEN BRUSH PINK,2980
MAGIC DRAWING SLATE DOLLY GIRL ,4474
MAGIC DRAWING SLATE CIRCUS PARADE  ,2633
MAGIC DRAWING SLATE LEAP FROG ,6711
MAGIC DRAWING SLATE SPACEBOY ,4409
MAGIC DRAWING SLATE BUNNIES ,4189
MAGIC DRAWING SLATE PURDEY,2486
MAGIC DRAWING SLATE DINOSAUR,4205
MINI JIGSAW DOLLY GIRL,5888
MINI JIGSAW BAKE A CAKE ,4404
MINI JIGSAW SPACEBOY,2600
MINI JIGSAW BUNNIES,4445
PICTURE DOMINOES,5476
HOLIDAY FUN LUDO,5648
PLASTERS IN TIN SPACEBOY,2005
PLASTERS IN TIN SKULLS,3815
PLASTERS IN TIN WOODLAND ANIMALS,4992
CLOTHES PEGS RETROSPOT PACK 24 ,4465
20 DOLLY PEGS RETROSPOT,1731
FELTCRAFT CUSHION OWL,1669
FELTCRAFT CUSHION RABBIT,6804
ROCKING HORSE RED CHRISTMAS ,5504
ROCKING HORSE GREEN CHRISTMAS ,3824
STAR WOODEN CHRISTMAS DECORATION,4952
HEART WOODEN CHRISTMAS DECORATION,4483
WOODEN TREE CHRISTMAS SCANDINAVIAN,4561
WOOD STOCKING CHRISTMAS SCANDISPOT,6078
PACK OF 6 PANNETONE GIFT BOXES,1520
FELTCRAFT HAIRBAND PINK AND BLUE,3374
CARD HOLDER GINGHAM HEART,4129
CARDHOLDER HOLLY WREATH METAL,3155
CHRISTMAS GINGHAM STAR,2194
CHRISTMAS GINGHAM TREE,2615
CHRISTMAS GINGHAM HEART,6339
CHRISTMAS RETROSPOT ANGEL WOOD,2373
CHRISTMAS RETROSPOT TREE WOOD,4585
PENS ASSORTED FUNKY JEWELED ,6214
PENS ASSORTED FUNNY FACE,3702
PACK OF 12 SPACEBOY TISSUES,2749
PACK OF 12 CIRCUS PARADE TISSUES ,1001
PACK OF 12 LONDON TISSUES ,3419
4 TRADITIONAL SPINNING TOPS,6552
TRADITIONAL KNITTING NANCY,5774
BOX OF VINTAGE ALPHABET BLOCKS,4157
BOX OF VINTAGE JIGSAW BLOCKS ,3812
IVORY KITCHEN SCALES,4340
SPACEBOY LUNCH BOX ,2736
DOLLY GIRL LUNCH BOX,2738
CIRCUS PARADE LUNCH BOX ,1371
HAND WARMER RED RETROSPOT,4501
HAND WARMER UNION JACK,2502
CERAMIC HEART FAIRY CAKE MONEY BANK,3333
CERAMIC STRAWBERRY CAKE MONEY BANK,5214
GENTLEMAN SHIRT REPAIR KIT ,2956
DELUXE SEWING KIT ,2381
LUNCH BOX I LOVE LONDON,3545
RECIPE BOX BLUE SKETCHBOOK DESIGN,1608
RECIPE BOX PANTRY YELLOW DESIGN,3609
RED BABY BUNTING ,1365
FRENCH BLUE METAL DOOR SIGN 1,1582
FRENCH BLUE METAL DOOR SIGN 2,2747
FRENCH BLUE METAL DOOR SIGN 3,1388
FRENCH BLUE METAL DOOR SIGN 8,6888
FRENCH BLUE METAL DOOR SIGN 9,1772
FRENCH BLUE METAL DOOR SIGN 0,1648
FRENCH BLUE METAL DOOR SIGN No,3481
WICKER STAR ,4313
GREEN REGENCY TEACUP AND SAUCER,2104
ROSES REGENCY TEACUP AND SAUCER ,1264
CARD DOLLY GIRL ,5043
CARD WEDDING DAY,6464
ALARM CLOCK BAKELIKE CHOCOLATE,1862
ALARM CLOCK BAKELIKE GREEN,6512
ALARM CLOCK BAKELIKE PINK,1732
ALARM CLOCK BAKELIKE ORANGE,5362
3D VINTAGE CHRISTMAS STICKERS ,4745
RIBBON REEL SOCKS AND MITTENS,2918
RIBBON REEL SNOWY VILLAGE,1454
RIBBON REEL CHRISTMAS SOCK BAUBLE,5455
POLKADOT PEN,1293
FUNKY DIVA PEN,3441
MAKE YOUR OWN PLAYTIME CARD KIT,4691
POPPY'S PLAYHOUSE BEDROOM ,4042
POPPY'S PLAYHOUSE LIVINGROOM ,6190
FELTCRAFT PRINCESS OLIVIA DOLL,5483
SMALL YELLOW BABUSHKA NOTEBOOK ,4000
SMALL RED BABUSHKA NOTEBOOK ,3220
SMALL PURPLE BABUSHKA NOTEBOOK ,3898
SET OF 3 NOTEBOOKS IN PARCEL,6536
CLEAR DRAWER KNOB ACRYLIC EDWARDIAN,2828
GREEN DRAWER KNOB ACRYLIC EDWARDIAN,1325
LANTERN CREAM GAZEBO ,1658
T-LIGHT HOLDER SWEETHEART HANGING,4862
T-LIGHT GLASS FLUTED ANTIQUE,4433
FLUTED ANTIQUE CANDLE HOLDER,4564
SWEETHEART RECIPE BOOK STAND,5182
ANTIQUE GLASS DRESSING TABLE POT,5230
ANTIQUE TALL SWIRLGLASS TRINKET POT,4702
BLUE DRAWER KNOB ACRYLIC EDWARDIAN,6168
SET OF 6 T-LIGHTS TOADSTOOLS,2167
SET OF 6 T-LIGHTS CACTI ,3343
PACK 3 BOXES CHRISTMAS PANNETONE,3555
CARD PSYCHEDELIC APPLES,6244
CARD MOTORBIKE SANTA,4921
CARD SUKI BIRTHDAY,6758
HAND WARMER BABUSHKA DESIGN,5456
HOT WATER BOTTLE I AM SO POORLY,3066
HOT WATER BOTTLE BABUSHKA ,2686
ROUND CAKE TIN VINTAGE RED,4401
BREAD BIN DINER STYLE RED ,2811
SET 20 NAPKINS FAIRY CAKES DESIGN ,6035
FINE WICKER HEART ,4456
HAND WARMER OWL DESIGN,1314
HAND WARMER SCOTTY DOG DESIGN,6186
HAND WARMER BIRD DESIGN,5743
NUMBER TILE VINTAGE FONT 1,2149
NUMBER TILE VINTAGE FONT 4,1409
NUMBER TILE VINTAGE FONT No ,3232
TEA FOR ONE POLKADOT,6127
CHILDRENS APRON APPLES DESIGN,1147
CHILDREN'S APRON DOLLY GIRL ,4102
 SET 2 TEA TOWELS I LOVE LONDON ,1877
TOTE BAG I LOVE LONDON,6125
CALENDAR PAPER CUT DESIGN,4034
12 MESSAGE CARDS WITH ENVELOPES,5103
PACK OF 20 NAPKINS RED APPLES,1061
SET OF 20 VINTAGE CHRISTMAS NAPKINS,4254
PAPER CHAIN KIT VINTAGE CHRISTMAS,3307
YELLOW COAT RACK PARIS FASHION,6807
APRON APPLE DELIGHT,2153
FELTCRAFT CHRISTMAS FAIRY,3156
CHRISTMAS LIGHTS 10 SANTAS ,3975
CHRISTMAS METAL TAGS ASSORTED ,1262
60 CAKE CASES DOLLY GIRL DESIGN,5860
60 CAKE CASES VINTAGE CHRISTMAS,2732
36 FOIL HEART CAKE CASES,4316
JAM MAKING SET WITH JARS,2807
JAM MAKING SET PRINTED,2555
JAM JAR WITH PINK LID,4614
JAM JAR WITH GREEN LID,6681
GINGERBREAD MAN COOKIE CUTTER,1246
ROSE COTTAGE KEEPSAKE BOX ,5864
HOMEMADE JAM SCENTED CANDLES,2580
CHILDRENS DOLLY GIRL MUG,1689
SPACEBOY CHILDRENS EGG CUP,2687
DOLLY GIRL CHILDRENS EGG CUP,6825
CARD BILLBOARD FONT,3821
SOLDIERS EGG CUP ,2267
PINK/WHITE CHRISTMAS TREE 60CM,5273
BLACK CHRISTMAS TREE 120CM,5996
VINTAGE BEAD PINK EVENING BAG,3795
VINTAGE BEAD PINK PURSE ,2912
VINTAGE BEAD NOTEBOOK,1556
ENAMEL PINK TEA CONTAINER,5176
4 PINK FLOCK CHRISTMAS BALLS,3895
SMALLFOLKART BAUBLE CHRISTMAS DEC,4023
FOLKART ZINC HEART CHRISTMAS DEC,6117
FOLKART HEART NAPKIN RINGS,6195
RETRO COFFEE MUGS ASSORTED,3729
CERAMIC CAKE BOWL + HANGING CAKES,1430
TEA TIME TEAPOT IN GIFT BOX,4654
TEA TIME TEA SET IN GIFT BOX,4880
WOVEN BERRIES CUSHION COVER ,4898
WOVEN CANDY CUSHION COVER ,4493
TEA TIME OVEN GLOVE,5766
PARTY BUNTING,4111
TEA TIME DES TEA COSY,6849
SCOTTIES CHILDRENS APRON,6380
PINK FAIRY CAKE CHILDRENS APRON,1979
DOORMAT TOPIARY,1578
DOORMAT ENGLISH ROSE ,4412
DOORMAT FAIRY CAKE,2824
LOVE HEART POCKET WARMER,4103
HI TEC ALPINE HAND WARMER,3695
SILVER BOOK MARK WITH BEADS,3511
SET/6 PURPLE BUTTERFLY T-LIGHTS,5633
SET/6 PINK  BUTTERFLY T-LIGHTS,3596
4 IVORY DINNER CANDLES SILVER FLOCK,3005
SET/3 ROSE CANDLE IN JEWELLED BOX,4635
SET/3 OCEAN SCENT CANDLE JEWEL BOX,6663
SET/3 VANILLA SCENTED CANDLE IN BOX,4580
SET OF 2 CHRISTMAS DECOUPAGE CANDLE,3549
CUPID DESIGN SCENTED CANDLES,2308
RETRO MOD TRAY,2681
PAINTED LIGHTBULB STAR+ MOON,6990
PAINTED LIGHTBULB RAINBOW DESIGN,6399
CHILLI LIGHTS,6711
VINYL RECORD FRAME SILVER,4050
WOODEN PICTURE FRAME WHITE FINISH,2965
LAUNDRY 15C METAL SIGN,5775
"AIRLINE LOUNGE,METAL SIGN",4033
KITCHEN METAL SIGN,3160
HOT BATHS METAL SIGN,3124
"METAL SIGN,CUPCAKE SINGLE HOOK",4491
METAL SIGN CUPCAKE SINGLE HOOK,3496
MAGIC TREE -PAPER FLOWERS,2007
RED WOOLLY HOTTIE WHITE HEART.,2786
KNITTED UNION FLAG HOT WATER BOTTLE,2818
ENGLISH ROSE HOT WATER BOTTLE,5799
CHARLIE+LOLA RED HOT WATER BOTTLE ,2821
CHARLIE LOLA BLUE HOT WATER BOTTLE ,6131
CHARLIE+LOLA PINK HOT WATER BOTTLE,4688
CHARLIE + LOLA RED HOT WATER BOTTLE,5626
PINK HEART SHAPE EGG FRYING PAN,2590
ROTATING SILVER ANGELS T-LIGHT HLDR,1728
SILVER CHRISTMAS TREE BAUBLE STAND ,3155
SET OF 20 KIDS COOKIE CUTTERS,2292
SET OF 3 HEART COOKIE CUTTERS,2908
SET OF 3 BUTTERFLY COOKIE CUTTERS,5958
YELLOW METAL CHICKEN HEART ,5237
FAIRY CAKE NOTEBOOK A5 SIZE,6164
FAIRY CAKES NOTEBOOK A6 SIZE,5757
ENGLISH ROSE NOTEBOOK A7 SIZE,5392
FAIRY CAKES NOTEBOOK A7 SIZE,3921
GIRLS ALPHABET IRON ON PATCHES ,5366
PACK 3 IRON ON DOG PATCHES,3336
PACK 6 HEART/ICE-CREAM PATCHES,3456
SMALL DOLLY MIX DESIGN ORANGE BOWL,3252
SMALL LICORICE DES PINK BOWL,6508
SMALL CHOCOLATES PINK BOWL,3409
BISCUITS SMALL BOWL LIGHT BLUE,6088
BLUE NEW BAROQUE CANDLESTICK CANDLE,4988
WHITE TRAVEL ALARM CLOCK,6890
BOX OF 24 COCKTAIL PARASOLS,2935
S/6 SEW ON CROCHET FLOWERS,3100
S/15 SILVER GLASS BAUBLES IN BAG,3287
JUNGLE POPSICLES ICE LOLLY HOLDERS,6910
ZINC WILLIE WINKIE  CANDLE STICK,6606
GREEN ROSE WASHBAG,5834
SOFT PINK ROSE TOWEL ,5738
MINT GREEN ROSE TOWEL,6739
PINK BUTTERFLY HANDBAG W BOBBLES,1692
MULTI COLOUR SILVER T-LIGHT HOLDER,6750
ANTIQUE SILVER TEA GLASS ETCHED,5195
SILVER HANGING T-LIGHT HOLDER,5904
ASSORTED COLOUR T-LIGHT HOLDER,1183
SET OF 16 VINTAGE SKY BLUE CUTLERY,2402
SINGLE HEART ZINC T-LIGHT HOLDER,1016
HANGING HEART ZINC T-LIGHT HOLDER,2721
SET OF 36 TEATIME PAPER DOILIES,1647
60 TEATIME FAIRY CAKE CASES,6602
72 SWEETHEART FAIRY CAKE CASES,5622
PINK 3 PIECE POLKADOT CUTLERY SET,6008
RED RETROSPOT UMBRELLA,6590
SET OF 12  VINTAGE POSTCARD SET,3522
ENVELOPE 50 ROMANTIC IMAGES,6617
ENVELOPE 50 BLOSSOM IMAGES,3896
PINK HEART SHAPE PHOTO FRAME,4394
YULETIDE IMAGES GIFT WRAP SET,5875
SET/4 RED MINI ROSE CANDLE IN BOWL,6676
S/4 IVORY MINI ROSE CANDLE IN BOWL,6218
S/4 BLACK MINI ROSE CANDLE IN BOWL,2050
TRADITIONAL CHRISTMAS RIBBONS,1889
SCANDINAVIAN REDS RIBBONS,4683
CREAM SWEETHEART MINI CHEST,2503
JUMBO BAG RED RETROSPOT,5439
JUMBO  BAG BAROQUE BLACK WHITE,5830
BLACK CANDELABRA T-LIGHT HOLDER,5099
WHITE HANGING HEART T-LIGHT HOLDER,1652
BEADED CRYSTAL HEART BLUE SMALL,6962
BEADED CRYSTAL HEART GREEN LARGE,6412
BEADED CRYSTAL HEART GREEN ON STICK,5731
BEADED CRYSTAL HEART PINK ON STICK,5997
RED DRAGONFLY HELICOPTER,5627
YELLOW SHARK HELICOPTER,3813
LADIES & GENTLEMEN METAL SIGN,5145
HAND OVER THE CHOCOLATE   SIGN ,3466
SET/6 EAU DE NIL BIRD T-LIGHTS,6308
SET/6 PINK BIRD T-LIGHT CANDLES,5791
SEWING SUSAN 21 NEEDLE SET,4559
PINK HORSE SOCK PUPPET,5887
SMALL HANGING IVORY/RED WOOD BIRD,3220
CINAMMON SET OF 9 T-LIGHTS,6412
ORANGE SCENTED SET/9 T-LIGHTS,5564
MIDNIGHT BLUE COPPER FLOWER NECKLAC,4573
COPPER/OLIVE GREEN FLOWER NECKLACE,1698
ROSE COLOUR PAIR HEART HAIR SLIDES,3887
JADE GREEN ENAMEL HAIR COMB,3241
MIDNIGHT BLUE VINTAGE EARRINGS,3511
GREEN VINTAGE EARRINGS ,2971
SILVER BLACK ORBIT BRACELET,2606
EDWARDIAN DROP EARRINGS JET BLACK,3192
RUBY GLASS CLUSTER EARRINGS,3386
CRYSTAL SEA HORSE PHONE CHARM,2689
NECKLACE+BRACELET SET BLUE HIBISCUS,2359
FRUIT SALAD BAG CHARM,6874
ST TROPEZ NECKLACE,1975
ANT COPPER RED BOUDICCA BRACELET,6803
2 DAISIES HAIR COMB,6943
DAISY HAIR COMB,2506
BLACK DIAMANTE EXPANDABLE RING,1992
GREEN DROP EARRINGS W BEAD CLUSTER,1327
PURPLE SWEETHEART BRACELET,4368
GREEN ENAMEL FLOWER HAIR TIE,1113
PAIR OF PINK FLOWER CLUSTER SLIDE,2750
GREEN ENAMEL+GLASS HAIR COMB,3620
RED   ACRYLIC FACETED BANGLE,3457
"LETTER ""D"" BLING KEY RING",2854
"LETTER ""H"" BLING KEY RING",1063
DOTCOM POSTAGE,5998
amazon,5393
SET/20 RED RETROSPOT PAPER NAPKINS ,2260
CHRISTMAS TOILET ROLL,2274
SET OF 72 RETROSPOT PAPER  DOILIES,6948
PACK OF 72 RETROSPOT CAKE CASES,5992
PACK OF 72 SKULL CAKE CASES,4496
STRAWBERRY CERAMIC TRINKET BOX,4684
STRAWBERRY CERAMIC TRINKET BOX,6363
BLUE POLKADOT CUP,6680
SKULLS WRITING SET ,1407
BALLOONS  WRITING SET ,4260
DINOSAURS  WRITING SET ,4799
MINI WOODEN HAPPY BIRTHDAY GARLAND,5170
SKULLS STORAGE BOX SMALL,4137
TOADSTOOL MONEY BOX,6988
WHITE SKULL HOT WATER BOTTLE ,4398
FAWN BLUE HOT WATER BOTTLE,2491
CHICK GREY HOT WATER BOTTLE,3438
RETROSPOT HEART HOT WATER BOTTLE,1360
RED WHITE SCARF  HOT WATER BOTTLE,1923
DOORMAT FANCY FONT HOME SWEET HOME,3237
DOORMAT SPOTTY HOME SWEET HOME,1140
CERAMIC STRAWBERRY MONEY BOX,6716
BLUE SPOT CERAMIC DRAWER KNOB,5144
WHITE SPOT BLUE CERAMIC DRAWER KNOB,3821
UNION JACK FLAG PASSPORT COVER ,1019
UNION JACK FLAG LUGGAGE TAG,4489
VINTAGE SNAKES & LADDERS,5162
JUMBO BAG PINK VINTAGE PAISLEY,2816
JUMBO STORAGE BAG SKULLS,3303
JUMBO STORAGE BAG SUKI,5325
SKULL SHOULDER BAG,1443
PACK OF 60 MUSHROOM CAKE CASES,4657
PACK OF 60 PINK PAISLEY CAKE CASES,6616
PACK OF 20 SKULL PAPER NAPKINS,4809
BLACK PIRATE TREASURE CHEST,2397
BROWN  PIRATE TREASURE CHEST ,2297
6 RIBBONS ELEGANT CHRISTMAS ,3039
6 RIBBONS RUSTIC CHARM,3550
RIBBON REEL HEARTS DESIGN ,4691
RIBBON REEL FLORA + FAUNA ,4121
RIBBON REEL STRIPES DESIGN ,1656
PAPER CHAIN KIT RETROSPOT,1457
PAPER CHAIN KIT EMPIRE,4498
PAPER CHAIN KIT 50'S CHRISTMAS ,4499
PAPER BUNTING RETROSPOT,2338
BIRD HOUSE HOT WATER BOTTLE,2840
SCOTTIE DOG HOT WATER BOTTLE,5684
CHOCOLATE HOT WATER BOTTLE,1342
GREY HEART HOT WATER BOTTLE,1874
HOT WATER BOTTLE TEA AND SYMPATHY,2352
FELTCRAFT BUTTERFLY HEARTS,4766
FELTCRAFT 6 FLOWER FRIENDS,6674
3 STRIPEY MICE FELTCRAFT,3583
PHOTO CUBE,5241
ROUND SNACK BOXES SET OF4 WOODLAND ,3306
ROUND SNACK BOXES SET OF 4 SKULLS,4293
CHARLOTTE BAG SUKI DESIGN,5097
CHARLOTTE BAG PINK POLKADOT,5515
CHILDRENS APRON SPACEBOY DESIGN,4932
BOTTLE BAG RETROSPOT ,5725
WALL TIDY RETROSPOT ,4777
RECYCLING BAG RETROSPOT ,4759
JUMBO SHOPPER VINTAGE RED PAISLEY,1464
PACK OF 60 SPACEBOY CAKE CASES,4358
10 COLOUR SPACEBOY PEN,5292
REGENCY CAKESTAND 3 TIER,3652
PACK OF 12 COLOURED PENCILS,3903
GARDENERS KNEELING PAD,1798
PLASTERS IN TIN SPACEBOY,1728
PLASTERS IN TIN SKULLS,4897
PLASTERS IN TIN WOODLAND ANIMALS,3747
CIRCUS PARADE LUNCH BOX ,1341
PIGGY BANK RETROSPOT ,4137
CERAMIC CHERRY CAKE MONEY BANK,6925
CERAMIC HEART FAIRY CAKE MONEY BANK,1791
CERAMIC STRAWBERRY CAKE MONEY BANK,6908
TRAVEL SEWING KIT,3792
DELUXE SEWING KIT ,4446
DOORMAT WELCOME TO OUR HOME,4848
WICKER STAR ,2424
ALARM CLOCK BAKELIKE CHOCOLATE,4653
ALARM CLOCK BAKELIKE GREEN,6505
ALARM CLOCK BAKELIKE RED ,3190
ALARM CLOCK BAKELIKE PINK,5300
ALARM CLOCK BAKELIKE ORANGE,3135
ALARM CLOCK BAKELIKE IVORY,5171
3D VINTAGE CHRISTMAS STICKERS ,4551
3D TRADITIONAL CHRISTMAS STICKERS,2293
SET OF 6 RIBBONS VINTAGE CHRISTMAS,2466
RIBBON REEL SOCKS AND MITTENS,1062
RIBBON REEL MAKING SNOWMEN ,3625
RIBBON REEL CHRISTMAS PRESENT ,5132
RIBBON REEL SNOWY VILLAGE,3588
RIBBON REEL CHRISTMAS SOCK BAUBLE,4263
PACK 3 BOXES CHRISTMAS PANNETONE,3783
HAND WARMER BABUSHKA DESIGN,3281
HOT WATER BOTTLE I AM SO POORLY,6742
HAND WARMER BIRD DESIGN,5409
PAPER CHAIN KIT VINTAGE CHRISTMAS,2878
CHRISTMAS LIGHTS 10 REINDEER,2787
60 CAKE CASES VINTAGE CHRISTMAS,2124
ZINC FOLKART SLEIGH BELLS,6178
TEA TIME OVEN GLOVE,4417
TEA TIME DES TEA COSY,6059
PINK FAIRY CAKE CHILDRENS APRON,1855
DOORMAT BLACK FLOCK ,4655
DOORMAT NEW ENGLAND,3299
DOORMAT FRIENDSHIP ,4789
CHILLI LIGHTS,6891
WOODEN FRAME ANTIQUE WHITE ,4498
RED WOOLLY HOTTIE WHITE HEART.,1364
KNITTED UNION FLAG HOT WATER BOTTLE,4689
ENGLISH ROSE HOT WATER BOTTLE,3990
CHARLIE+LOLA RED HOT WATER BOTTLE ,6075
CHARLIE LOLA BLUE HOT WATER BOTTLE ,4647
CHARLIE+LOLA PINK HOT WATER BOTTLE,6320
CHARLIE + LOLA RED HOT WATER BOTTLE,6047
ROTATING SILVER ANGELS T-LIGHT HLDR,3668
SET OF 3 BUTTERFLY COOKIE CUTTERS,6082
BOX OF 24 COCKTAIL PARASOLS,4184
SET OF 36 TEATIME PAPER DOILIES,1465
75 GREEN FAIRY CAKE CASES,1661
60 TEATIME FAIRY CAKE CASES,5504
RED 3 PIECE RETROSPOT CUTLERY SET,1064
PINK 3 PIECE POLKADOT CUTLERY SET,3078
TRADITIONAL CHRISTMAS RIBBONS,6748
SCANDINAVIAN REDS RIBBONS,2732
JUMBO  BAG BAROQUE BLACK WHITE,2902
JUMBO BAG STRAWBERRY,3632
WHITE HANGING HEART T-LIGHT HOLDER,6421
PINK POLKADOT BOWL,3940
DOORMAT RED RETROSPOT,2146
JUMBO BAG TOYS ,3895
JUMBO BAG WOODLAND ANIMALS,5805
STRAWBERRY SHOPPER BAG,1035
RED RETROSPOT SHOPPER BAG,5739
WOODLAND CHARLOTTE BAG,6402
STRAWBERRY CHARLOTTE BAG,6478
RED RETROSPOT CHARLOTTE BAG,3545
LUNCH BAG WOODLAND,4043
LUNCH BAG  BLACK SKULL.,6085
LUNCH BAG CARS BLUE,1907
SILVER MINI TAPE MEASURE ,4889
BLACK MINI TAPE MEASURE ,4211
WATERMELON BATH SPONGE,2564
STRAWBERRY BATH SPONGE ,3767
APPLE BATH SPONGE,5093
SANDWICH BATH SPONGE,4383
SET/20 STRAWBERRY PAPER NAPKINS ,6510
EDWARDIAN PARASOL NATURAL,6670
EDWARDIAN PARASOL RED,2338
LUNCH BAG RED RETROSPOT,6788
GLITTER BUTTERFLY CLIPS,1075
SET/2 RED RETROSPOT TEA TOWELS ,3232
VINTAGE BILLBOARD DRINK ME MUG,3429
SET/6 RED SPOTTY PAPER CUPS,2915
ROSE CARAVAN DOORSTOP,2218
OWL DOORSTOP,6745
RED RETROSPOT OVEN GLOVE ,1759
RETROSPOT CHILDRENS APRON,1395
WHITE BELL HONEYCOMB PAPER ,5190
"SET 3 RETROSPOT TEA,COFFEE,SUGAR",2349
RED SPOTTY BISCUIT TIN,3611
WOODLAND  HEIGHT CHART STICKERS ,2816
VICTORIAN SEWING BOX LARGE,4791
HOME SMALL WOOD LETTERS,3901
COUNTRY COTTAGE  DOORSTOP GREEN,3635
GINGHAM HEART  DOORSTOP RED,3160
RED WHITE SCARF  HOT WATER BOTTLE,3432
ROTATING LEAVES T-LIGHT HOLDER,6020
SKULLS  WATER TRANSFER TATTOOS ,1272
SKULL LUNCH BOX WITH CUTLERY ,1902
HEART T-LIGHT HOLDER ,6045
I CAN ONLY PLEASE ONE PERSON MUG,2724
GIN AND TONIC MUG,2059
WOODEN BOX OF DOMINOES,3869
SUKI  SHOULDER BAG,2591
SKULLS DESIGN FLANNEL,6836
BOUDOIR SQUARE TISSUE BOX,6399
SKULLS SQUARE TISSUE BOX,4632
PIZZA PLATE IN BOX,4966
CHRISTMAS CRAFT TREE TOP ANGEL,2793
CHRISTMAS CRAFT LITTLE FRIENDS,2474
SNOWSTORM PHOTO FRAME FRIDGE MAGNET,6664
GREEN CHRISTMAS TREE CARD HOLDER,2096
SMALL HEART MEASURING SPOONS,2177
OVERNIGHT BAG VINTAGE ROSE PAISLEY,2260
AIRLINE BAG VINTAGE WORLD CHAMPION ,5973
JUMBO BAG PINK POLKADOT,6937
NATURAL SLATE CHALKBOARD LARGE ,1883
NATURAL SLATE HEART CHALKBOARD ,6157
HANGING METAL STAR LANTERN,2609
BABUSHKA LIGHTS STRING OF 10,5898
HEART OF WICKER SMALL,1264
HEART OF WICKER LARGE,5974
TV DINNER TRAY DOLLY GIRL,3856
SPACEBOY TV DINNER TRAY,6891
NATURAL SLATE RECTANGLE CHALKBOARD,5097
PICNIC BASKET WICKER SMALL,6190
CHILDS GARDEN RAKE BLUE,2761
CHILDS GARDEN BRUSH BLUE,2123
CHILDS GARDEN BRUSH PINK,4224
FELTCRAFT CUSHION BUTTERFLY,5916
WOODEN CROQUET GARDEN SET,5306
BOX OF VINTAGE ALPHABET BLOCKS,4600
LUNCH BOX I LOVE LONDON,4524
RECIPE BOX BLUE SKETCHBOOK DESIGN,1625
TEA FOR ONE POLKADOT,2282
PEG BAG APPLES DESIGN,6813
 SET 2 TEA TOWELS I LOVE LONDON ,3077
WOODEN ADVENT CALENDAR CREAM,1993
WOODEN ADVENT CALENDAR RED,1309
MULTICOLOUR SPRING FLOWER MUG,4750
RETRO COFFEE MUGS ASSORTED,5588
PARTY BUNTING,6866
TEA TIME PARTY BUNTING,5093
SET/6 PURPLE BUTTERFLY T-LIGHTS,1091
GRAND CHOCOLATECANDLE,4900
BATHROOM METAL SIGN,5765
TOILET METAL SIGN,3071
AREA PATROLLED METAL SIGN,2255
HOT BATHS METAL SIGN,5822
KNITTED UNION FLAG HOT WATER BOTTLE,5785
TEATIME FUNKY FLOWER BACKPACK FOR 2,2006
JUMBO BAG RED RETROSPOT,2231
HAND OVER THE CHOCOLATE   SIGN ,6152
CACTI T-LIGHT CANDLES,3079
DOTCOM POSTAGE,2547
WHITE HONEYCOMB PAPER GARLAND ,2093
WHITE BELL HONEYCOMB PAPER ,4766
RED RETROSPOT ROUND CAKE TINS,2372
RED SPOTTY BISCUIT TIN,5256
VICTORIAN SEWING BOX MEDIUM,5271
VICTORIAN SEWING BOX LARGE,1985
VICTORIAN SEWING BOX SMALL ,1730
RED GINGHAM ROSE JEWELLERY BOX,4389
FAWN BLUE HOT WATER BOTTLE,1305
RED WHITE SCARF  HOT WATER BOTTLE,3923
ROTATING LEAVES T-LIGHT HOLDER,5211
SKULL LUNCH BOX WITH CUTLERY ,3341
STRAWBERRY LUNCH BOX WITH CUTLERY,4021
LOLITA  DESIGN  COTTON TOTE BAG,5124
SET 12 LAVENDER  BOTANICAL T-LIGHTS,2362
VINTAGE UNION JACK MEMOBOARD,5839
VINTAGE UNION JACK APRON,2298
BIG DOUGHNUT FRIDGE MAGNETS,4567
FOLDING UMBRELLA RED/WHITE POLKADOT,5970
CHOCOLATE CALCULATOR,2887
PINK UNION JACK  LUGGAGE TAG,3125
POTTERING MUG,3601
WOODEN BOX OF DOMINOES,2039
MAN FLU METAL SIGN,6501
SUKI  SHOULDER BAG,4232
STRAWBERRY   PICNIC BAG,4551
PIZZA PLATE IN BOX,4940
PINK LOVE HEART SHAPE CUP,1016
LADLE LOVE HEART RED ,6768
CHRISTMAS CRAFT TREE TOP ANGEL,4876
CHRISTMAS CRAFT LITTLE FRIENDS,5841
WALL MIRROR RECTANGLE DIAMANTE PINK,2806
3 HOOK PHOTO SHELF ANTIQUE WHITE,6420
METAL 4 HOOK HANGER FRENCH CHATEAU,6864
SET 10 LIGHTS NIGHT OWL,3312
GREEN CHRISTMAS TREE CARD HOLDER,5703
SMALL HEART MEASURING SPOONS,2128
SMALL POPCORN HOLDER,1369
FRYING PAN UNION FLAG,1714
LOVEBIRD HANGING DECORATION WHITE ,3206
OVERNIGHT BAG VINTAGE ROSE PAISLEY,1902
6 EGG HOUSE PAINTED WOOD,5679
ILLUSTRATED CAT BOWL ,6967
LUNCH BOX WITH CUTLERY RETROSPOT ,4534
KINGS CHOICE BISCUIT TIN,7000
KINGS CHOICE TEA CADDY ,3484
AIRLINE BAG VINTAGE TOKYO 78,2028
LUNCH BAG SUKI  DESIGN ,3437
METAL SIGN NEIGHBOURHOOD WITCH ,2729
NATURAL SLATE CHALKBOARD LARGE ,6051
NATURAL SLATE HEART CHALKBOARD ,2985
RED GINGHAM TEDDY BEAR ,4747
PICNIC BASKET WICKER LARGE,5086
PICNIC BASKET WICKER SMALL,5196
MEMO BOARD RETROSPOT  DESIGN,4846
CHILDS GARDEN SPADE PINK,5421
CHILDRENS GARDEN GLOVES PINK,2330
HOLIDAY FUN LUDO,6003
FELTCRAFT CUSHION BUTTERFLY,2085
SET OF 6 SOLDIER SKITTLES,4616
BOX OF VINTAGE ALPHABET BLOCKS,2041
BOX OF VINTAGE JIGSAW BLOCKS ,2226
IVORY KITCHEN SCALES,1491
BUTTON BOX ,2862
LUNCH BOX I LOVE LONDON,1309
RECIPE BOX BLUE SKETCHBOOK DESIGN,2204
GREEN REGENCY TEACUP AND SAUCER,4645
ROSES REGENCY TEACUP AND SAUCER ,4072
SET 7 BABUSHKA NESTING BOXES,3812
SWEETHEART RECIPE BOOK STAND,2214
3 TIER CAKE TIN RED AND CREAM,3890
TEA FOR ONE POLKADOT,3310
CHILDREN'S APRON DOLLY GIRL ,1641
 SET 2 TEA TOWELS I LOVE LONDON ,6254
WOODEN ADVENT CALENDAR CREAM,1695
WOODEN ADVENT CALENDAR RED,4593
CHILDREN'S SPACEBOY MUG,5802
MULTICOLOUR SPRING FLOWER MUG,5708
RETRO COFFEE MUGS ASSORTED,1754
PARTY BUNTING,1721
DOORMAT 3 SMILEY CATS,6901
HI TEC ALPINE HAND WARMER,4937
WHITE METAL LANTERN,5597
SET/6 PURPLE BUTTERFLY T-LIGHTS,3419
GRAND CHOCOLATECANDLE,5011
BATHROOM METAL SIGN,5187
TOILET METAL SIGN,4402
HOT BATHS METAL SIGN,4211
FANNY'S REST STOPMETAL SIGN,3354
KNITTED UNION FLAG HOT WATER BOTTLE,2783
CHARLIE+LOLA PINK HOT WATER BOTTLE,5531
3D SHEET OF DOG STICKERS,1772
3D SHEET OF CAT STICKERS,1952
SMALL LICORICE DES PINK BOWL,5509
PINK STITCHED WALL CLOCK,4891
COLOUR GLASS T-LIGHT HOLDER HANGING,1966
ANT WHITE WIRE HEART SPIRAL,6496
ANTIQUE SILVER TEA GLASS ETCHED,4764
SINGLE HEART ZINC T-LIGHT HOLDER,3237
HANGING HEART ZINC T-LIGHT HOLDER,3436
RED RETROSPOT UMBRELLA,6211
JUMBO BAG RED RETROSPOT,6896
RED ENCHANTED FOREST PLACEMAT,2966
LADIES & GENTLEMEN METAL SIGN,5365
SET/6 FROG PRINCE T-LIGHT CANDLES,5356
DOTCOM POSTAGE,5209
INFLATABLE POLITICAL GLOBE ,2736
EDWARDIAN PARASOL NATURAL,2526
PORCELAIN BUTTERFLY OIL BURNER,4074
PINK POLKADOT CHILDRENS UMBRELLA,1693
RED RETROSPOT CHILDRENS UMBRELLA,1189
LUNCH BAG RED RETROSPOT,4930
BLUE POLKADOT WASHING UP GLOVES,5739
GLITTER BUTTERFLY CLIPS,3984
BOX OF 9 PEBBLE CANDLES,5294
PINK FLORAL FELTCRAFT SHOULDER BAG,6036
36 PENCILS TUBE SKULLS,1108
RED RETROSPOT OVEN GLOVE DOUBLE,4829
OWL DOORSTOP,1266
RETROSPOT CHILDRENS APRON,1916
RED RETROSPOT WASHBAG,4433
PLEASE ONE PERSON METAL SIGN,4986
RED RETROSPOT WASHBAG,1450
BEWARE OF THE CAT METAL SIGN ,4301
COOK WITH WINE METAL SIGN ,5777
YOU'RE CONFUSING ME METAL SIGN ,5812
GIN + TONIC DIET METAL SIGN,5100
PLEASE ONE PERSON METAL SIGN,3732
RED RETROSPOT ROUND CAKE TINS,1643
RED SPOTTY BISCUIT TIN,5712
VICTORIAN SEWING BOX MEDIUM,5077
VICTORIAN SEWING BOX LARGE,3246
WHITE SKULL HOT WATER BOTTLE ,6058
FAWN BLUE HOT WATER BOTTLE,2943
ROTATING LEAVES T-LIGHT HOLDER,4266
SET OF 6 FUNKY BEAKERS,6138
SKULL LUNCH BOX WITH CUTLERY ,2698
STRAWBERRY LUNCH BOX WITH CUTLERY,1032
BIG DOUGHNUT FRIDGE MAGNETS,1573
DECORATIVE FLORE BATHROOM BOTTLE,3348
POLKADOT RAIN HAT ,2508
CHOCOLATE CALCULATOR,3092
GIN AND TONIC MUG,5457
POTTERING MUG,2653
BINGO SET,4783
WOODEN BOX OF DOMINOES,4557
SUKI  SHOULDER BAG,6896
SET OF 6 CAKE CHOPSTICKS,2672
PACK OF 12 SKULL TISSUES,3768
FLORAL FOLK STATIONERY SET,3912
FULL ENGLISH BREAKFAST PLATE,6155
HOT WATER BOTTLE TEA AND SYMPATHY,1529
LADLE LOVE HEART PINK,3946
CHRISTMAS CRAFT LITTLE FRIENDS,5892
METAL 4 HOOK HANGER FRENCH CHATEAU,4827
SET 10 LIGHTS NIGHT OWL,6476
RED STAR CARD HOLDER,1572
SMALL POPCORN HOLDER,6491
FRYING PAN UNION FLAG,6321
WOOD STAMP SET THANK YOU,3188
HEART IVORY TRELLIS LARGE,6758
HEART IVORY TRELLIS SMALL,5906
COFFEE MUG CAT + BIRD DESIGN,1582
OFFICE MUG WARMER CHOC+BLUE,5382
ILLUSTRATED CAT BOWL ,3255
LUNCH BOX WITH CUTLERY RETROSPOT ,2407
KINGS CHOICE BISCUIT TIN,2736
KINGS CHOICE TEA CADDY ,4283
DOORMAT AIRMAIL ,3885
LUNCH BAG SUKI  DESIGN ,1773
JUMBO BAG PINK POLKADOT,6687
TOOTHPASTE TUBE PEN,2180
ENAMEL WATERING CAN CREAM,3110
WATERING CAN PINK BUNNY,2192
NATURAL SLATE HEART CHALKBOARD ,3621
BABUSHKA LIGHTS STRING OF 10,4835
HEART OF WICKER SMALL,5164
PICNIC BASKET WICKER LARGE,5867
MEMO BOARD RETROSPOT  DESIGN,5247
DOORSTOP FOOTBALL DESIGN,3656
CHILDS GARDEN BRUSH BLUE,1251
CHILDS GARDEN BRUSH PINK,3386
CHILDRENS GARDEN GLOVES PINK,6054
WOODEN CROQUET GARDEN SET,3474
SET OF 6 SOLDIER SKITTLES,5483
RED KITCHEN SCALES,4133
SPACEBOY LUNCH BOX ,6353
LUNCH BOX I LOVE LONDON,2431
RECIPE BOX PANTRY YELLOW DESIGN,5930
FRENCH BLUE METAL DOOR SIGN 8,6652
GREEN REGENCY TEACUP AND SAUCER,2015
ROSES REGENCY TEACUP AND SAUCER ,2334
GUMBALL MONOCHROME COAT RACK,2921
SET 7 BABUSHKA NESTING BOXES,5082
SMALL RED BABUSHKA NOTEBOOK ,5511
SWEETHEART RECIPE BOOK STAND,3384
SET OF 6 T-LIGHTS SNOWMEN,2355
3 TIER CAKE TIN RED AND CREAM,3761
3 TIER CAKE TIN GREEN AND CREAM,4668
PEG BAG APPLES DESIGN,2380
WOODEN ADVENT CALENDAR RED,5545
JAM MAKING SET PRINTED,3120
RETRO COFFEE MUGS ASSORTED,6051
DOORMAT 3 SMILEY CATS,2935
COLOUR GLASS. STAR T-LIGHT HOLDER,2237
SET/6 PURPLE BUTTERFLY T-LIGHTS,5083
SET/6 TURQUOISE BUTTERFLY T-LIGHTS,2674
CORONA MEXICAN TRAY,4894
BATHROOM METAL SIGN,5877
TOILET METAL SIGN,5265
FANNY'S REST STOPMETAL SIGN,1038
NO SINGING METAL SIGN,1958
SET OF 4 POLKADOT PLACEMATS ,1810
SET OF 4 POLKADOT COASTERS,5345
SMALL DOLLY MIX DESIGN ORANGE BOWL,3387
SMALL LICORICE DES PINK BOWL,6272
PINK STITCHED WALL CLOCK,4797
ANT WHITE WIRE HEART SPIRAL,2708
HAND TOWEL PINK FLOWER AND DAISY,5111
MULTI COLOUR SILVER T-LIGHT HOLDER,6322
BOX OF 6 ASSORTED COLOUR TEASPOONS,6768
SINGLE HEART ZINC T-LIGHT HOLDER,1512
HANGING HEART ZINC T-LIGHT HOLDER,2448
ROSE 3 WICK MORRIS BOX CANDLE,6180
6 CHOCOLATE LOVE HEART T-LIGHTS,3753
15CM CHRISTMAS GLASS BALL 20 LIGHTS,4724
JUMBO BAG RED RETROSPOT,1780
WATERING CAN SINGLE HOOK PISTACHIO,2600
CHARLIE + LOLA BISCUITS TINS,3367
DOTCOM POSTAGE,3745
EDWARDIAN PARASOL BLACK,4490
PORCELAIN BUTTERFLY OIL BURNER,3282
QUEEN OF SKIES LUGGAGE TAG,2909
RED RETROSPOT LUGGAGE TAG,4357
RED RETROSPOT CHILDRENS UMBRELLA,3316
STRAWBERRY CHARLOTTE BAG,5006
RED RETROSPOT CHARLOTTE BAG,3940
LUNCH BAG RED RETROSPOT,4499
GLITTER BUTTERFLY CLIPS,5438
PINK FLORAL FELTCRAFT SHOULDER BAG,6400
JAZZ HEARTS ADDRESS BOOK,6330
JUMBO BAG CHARLIE AND LOLA TOYS,6079
SET/2 RED RETROSPOT TEA TOWELS ,2630
