ProductName,Price
DOORMAT HEARTS,1418
DOORMAT NEW ENGLAND,1841
DOORMAT HOME SWEET HOME BLUE ,2178
FAMILY PHOTO FRAME CORNICE,2535
PIGGY BANK RETROSPOT ,2891
MONEY BOX KINGS CHOICE DESIGN,3478
BLUE WIRE SPIRAL CANDLE HOLDER,3681
UTILTY CABINET WITH HOOKS,2357
BLACK HEART CARD HOLDER,6648
SCENTED CANDLE IN DIGITALIS TIN,5303
HANGING HEART JAR T-LIGHT HOLDER,5229
HOME SMALL WOOD LETTERS,6122
S/12 VANILLA  BOTANICAL T-LIGHTS,2551
SET 12 LAVENDER  BOTANICAL T-LIGHTS,6994
TRADITIONAL WOODEN SKIPPING ROPE,4111
SILVER PLATE CANDLE BOWL SMALL,3619
MONEY BOX POCKET MONEY DESIGN,2635
PHOTO FRAME CORNICE,1685
SMALL SILVER FLOWER CANDLE POT,2877
SMALL HAMMERED SILVER CANDLEPOT ,3270
WOODEN BOX OF DOMINOES,4575
TRIPLE PHOTO FRAME CORNICE ,1373
LOVE LARGE WOOD LETTERS ,3279
BOX OF VINTAGE ALPHABET BLOCKS,5770
BOX OF VINTAGE JIGSAW BLOCKS ,2414
HOME SMALL WOOD LETTERS,6435
CERAMIC STRAWBERRY MONEY BOX,3183
SET OF 2 TINS VINTAGE BATHROOM ,1265
SET OF 2 TINS JARDIN DE PROVENCE,4002
WHITE BELL HONEYCOMB PAPER GARLAND ,1828
WHITE CHRYSANTHEMUMS ART FLOWER,5641
CHILLI LIGHTS,2307
GRAND CHOCOLATECANDLE,4981
CHRISTMAS LIGHTS 10 VINTAGE BAUBLES,1997
"KEY FOB , GARAGE DESIGN",3438
"KEY FOB , BACK DOOR ",3612
WHITE CHRISTMAS STAR DECORATION,5025
CHRISTMAS TREE HEART DECORATION,2175
WHITE CHRISTMAS GARLAND STARS TREES,1125
SWALLOW WOODEN CHRISTMAS DECORATION,6525
RETRO PLASTIC ELEPHANT TRAY,2816
RETRO PLASTIC DAISY TRAY,2650
WOOD STOCKING CHRISTMAS SCANDISPOT,5597
"KEY FOB , GARAGE DESIGN",2979
"KEY FOB , BACK DOOR ",2714
"KEY FOB , SHED",3996
WHITE CHRISTMAS STAR DECORATION,6316
SWISS CHALET TREE DECORATION ,2631
SOAP DISH BROCANTE,6272
CARD HOLDER GINGHAM HEART,2321
CARDHOLDER GINGHAM STAR,3470
PINK HEART SHAPE PHOTO FRAME,3423
ROTATING SILVER ANGELS T-LIGHT HLDR,2289
SWALLOW WOODEN CHRISTMAS DECORATION,5403
HEART DECORATION WITH PEARLS ,2599
"KEY FOB , BACK DOOR ",6058
CHRISTMAS RETROSPOT TREE WOOD,1382
SWISS CHALET TREE DECORATION ,3091
HOMEMADE JAM SCENTED CANDLES,6011
SOAP DISH BROCANTE,3727
WASHROOM METAL SIGN,5908
CHRISTMAS CRAFT WHITE FAIRY ,6202
HAND WARMER SCOTTY DOG DESIGN,3976
PAPER CHAIN KIT VINTAGE CHRISTMAS,6280
PAPER CHAIN KIT 50'S CHRISTMAS ,5233
ROTATING SILVER ANGELS T-LIGHT HLDR,5013
SET/3 CHRISTMAS DECOUPAGE CANDLES,2201
SET/9 CHRISTMAS T-LIGHTS SCENTED ,1820
WHITE HANGING HEART T-LIGHT HOLDER,5934
CHRISTMAS CRAFT WHITE FAIRY ,1680
CHRISTMAS RETROSPOT STAR WOOD,2641
15CM CHRISTMAS GLASS BALL 20 LIGHTS,3045
HOLIDAY FUN LUDO,2847
VINTAGE SEASIDE JIGSAW PUZZLES,2630
BINGO SET,6778
ANTIQUE TALL SWIRLGLASS TRINKET POT,4537
SET OF 6 T-LIGHTS SANTA,6255
ASSORTED COLOUR T-LIGHT HOLDER,3755
ANTIQUE SILVER TEA GLASS ETCHED,1400
CHRISTMAS RETROSPOT TREE WOOD,1472
PAPER CHAIN KIT VINTAGE CHRISTMAS,6579
CHRISTMAS CRAFT LITTLE FRIENDS,5851
WHITE CHRISTMAS GARLAND STARS TREES,4776
WHITE CHRISTMAS STAR DECORATION,3868
SET OF 6 T-LIGHTS SNOWMEN,6440
CHRISTMAS TREE HEART DECORATION,2219
CHRISTMAS TREE HEART DECORATION,1366
HEADS AND TAILS SPORTING FUN,5755
VINTAGE HEADS AND TAILS CARD GAME ,3446
VINTAGE SNAP CARDS,1949
PLACE SETTING WHITE HEART,5675
GLITTER CHRISTMAS TREE WITH BELLS,4000
ANGEL DECORATION STARS ON DRESS,5069
SINGLE HEART ZINC T-LIGHT HOLDER,1940
HANGING HEART ZINC T-LIGHT HOLDER,5344
GARLAND WITH STARS AND BELLS,6234
STAR DECORATION RUSTIC,1248
GLITTER HEART GARLAND WITH BELLS ,5106
ANGEL DECORATION WITH LACE PADDED,2964
GOLD MUG BONE CHINA TREE OF LIFE,6203
CHRISTMAS CRAFT TREE TOP ANGEL,1642
ANTIQUE GLASS HEART DECORATION ,1912
CINAMMON & ORANGE WREATH,6336
CINAMMON & ORANGE WREATH,5382
BLUE KNITTED EGG COSY,2494
CHRISTMAS RETROSPOT HEART WOOD,2409
WOODEN TREE CHRISTMAS SCANDINAVIAN,5668
WOOD STOCKING CHRISTMAS SCANDISPOT,5034
SUNSET CHECK HAMMOCK,5933
RETRO PLASTIC POLKA TRAY,2026
GREEN GIANT GARDEN THERMOMETER,2807
IVORY GIANT GARDEN THERMOMETER,5379
CALENDAR IN SEASON DESIGN,5307
I CAN ONLY PLEASE ONE PERSON MUG,3090
WHITE CHRISTMAS STAR DECORATION,4473
SOAP DISH BROCANTE,3019
PACK OF 6 PANNETONE GIFT BOXES,2435
PACK OF 6 BIRDY GIFT TAGS,1471
PACK OF 6 SWEETIE GIFT BOXES,5423
RED DAISY POCKET BOOK ,1398
WHITE BROCANTE SOAP DISH,6032
RED DAISY POCKET BOOK ,3490
RED DAISY POCKET BOOK ,6589
ABSTRACT CIRCLES SKETCHBOOK ,3252
ABSTRACT CIRCLE JOURNAL ,6528
CHRYSANTHEMUM  JOURNAL,3671
CHRYSANTHEMUM SKETCHBOOK ,5717
GREEN FERN NOTEBOOK,1961
BLUE PAISLEY NOTEBOOK,3120
GREEN FERN NOTEBOOK,3025
SET OF 6 KASHMIR FOLKART BAUBLES,5546
RED KITCHEN SCALES,4303
36 DOILIES DOLLY GIRL,1313
HOME SWEET HOME MUG,2546
ASSTD MULTICOLOUR CIRCLES MUG,4133
BROCANTE SHELF WITH HOOKS,6652
6 EGG HOUSE PAINTED WOOD,4041
PACK OF 60 MUSHROOM CAKE CASES,6321
FRENCH CHATEAU LARGE PLATTER ,2820
HOT BATHS SOAP HOLDER,3827
PINK OVAL JEWELLED MIRROR,2396
Manual,4103
CORONA MEXICAN TRAY,4179
ENAMEL WASH BOWL CREAM,6109
WOOD STAMP SET THANK YOU,4992
12 RED ROSE PEG PLACE SETTINGS,4054
12 IVORY ROSE PEG PLACE SETTINGS,6962
6 RIBBONS RUSTIC CHARM,5987
TRADITIONAL CHRISTMAS RIBBONS,5245
6 RIBBONS EMPIRE  ,6008
6 RIBBONS ELEGANT CHRISTMAS ,5655
TRADITIONAL CHRISTMAS RIBBONS,5146
SCANDINAVIAN REDS RIBBONS,3888
BRIGHT BLUES RIBBONS ,3731
6 RIBBONS SHIMMERING PINKS ,1481
3 TRADITIONAl BISCUIT CUTTERS  SET,2816
PINK KNITTED EGG COSY,1908
BLUE KNITTED EGG COSY,5084
ENAMEL MEASURING JUG CREAM,6177
ENVELOPE 50 CURIOUS IMAGES,2026
ENAMEL BREAD BIN CREAM,6314
MILK BOTTLE WITH GLASS STOPPER ,3941
GLASS  BEURRE DISH,5591
FOLDING CAMPING SCISSOR W/KNIF & S,6868
PAPER CHAIN KIT 50'S CHRISTMAS ,1653
COLOURING PENCILS BROWN TUBE,4358
HAND OPEN SHAPE DECO.WHITE,5503
PINK JEWELLED MIRROR TRINKET TRAY,1673
SANDALWOOD FAN,1042
WHITE SAGE INCENSE,5599
ENAMEL WATERING CAN CREAM,4265
AFGHAN SLIPPER SOCK PAIR,2710
SET OF 6 T-LIGHTS CACTI ,1968
CITRONELLA CANDLE FLOWERPOT,3628
GREEN GIANT GARDEN THERMOMETER,6636
SMALL GLASS SUNDAE DISH CLEAR,2603
VINTAGE CARAVAN GIFT WRAP,2640
WRAP GREEN PEARS ,3633
GOLD EAR MUFF HEADPHONES,5460
IVORY KNITTED MUG COSY ,2577
PAPERWEIGHT SAVE THE PLANET,2184
CHRISTMAS LIGHTS 10 REINDEER,1664
WICKER WREATH LARGE,6666
RED DINER WALL CLOCK,4193
PACK OF 72 RETROSPOT CAKE CASES,6612
PACK OF 60 PINK PAISLEY CAKE CASES,6155
60 TEATIME FAIRY CAKE CASES,3059
PACK OF 72 SKULL CAKE CASES,6374
SET/20 RED RETROSPOT PAPER NAPKINS ,3217
HAND WARMER RED RETROSPOT,3342
200 RED + WHITE BENDY STRAWS,1827
STRAWBERRY CERAMIC TRINKET BOX,3922
EDWARDIAN PARASOL NATURAL,6996
HOT WATER BOTTLE BABUSHKA ,3790
HAND WARMER SCOTTY DOG DESIGN,5254
HAND WARMER BIRD DESIGN,6745
INFLATABLE POLITICAL GLOBE ,3753
RED TOADSTOOL LED NIGHT LIGHT,4680
LUNCH BAG SUKI  DESIGN ,2935
JUMBO BAG RED RETROSPOT,5947
BLACK/BLUE POLKADOT UMBRELLA,2278
CHRISTMAS CRAFT LITTLE FRIENDS,4093
JAM MAKING SET PRINTED,4412
RED HANGING HEART T-LIGHT HOLDER,6729
COLOUR GLASS. STAR T-LIGHT HOLDER,3724
SET/3 VANILLA SCENTED CANDLE IN BOX,3178
SET/3 ROSE CANDLE IN JEWELLED BOX,1357
DOORMAT HEARTS,6375
DOORMAT 3 SMILEY CATS,1145
HAND WARMER BIRD DESIGN,4964
HAND WARMER SCOTTY DOG DESIGN,5325
HAND WARMER UNION JACK,6906
RED  HARMONICA IN BOX ,5760
BLUE HARMONICA IN BOX ,5850
HOT WATER BOTTLE TEA AND SYMPATHY,6467
CHOCOLATE HOT WATER BOTTLE,2076
HOT WATER BOTTLE I AM SO POORLY,1261
FAIRY CAKE FLANNEL ASSORTED COLOUR,2078
"LARGE CAKE TOWEL, CHOCOLATE SPOTS",5342
LARGE CAKE TOWEL PINK SPOTS,5964
PINK HEART SHAPE EGG FRYING PAN,4889
COFFEE MUG BLUE PAISLEY DESIGN,6844
SWEETHEART CARRY-ALL BASKET,4828
TRAVEL SEWING KIT,6718
DELUXE SEWING KIT ,4122
VICTORIAN SEWING BOX SMALL ,5342
PACK OF 6 PANNETONE GIFT BOXES,6632
WOOD BLACK BOARD ANT WHITE FINISH,3389
DOLLY GIRL LUNCH BOX,6254
6 ROCKET BALLOONS ,2004
RED RETROSPOT MUG,3534
PACK 3 BOXES CHRISTMAS PANNETONE,2454
BUTTON BOX ,2270
BOX OF VINTAGE ALPHABET BLOCKS,1063
MAGIC DRAWING SLATE PURDEY,4822
VINTAGE HEADS AND TAILS CARD GAME ,5619
WOODEN BOX OF DOMINOES,5872
LUNCH BOX I LOVE LONDON,4785
15CM CHRISTMAS GLASS BALL 20 LIGHTS,2989
DOORMAT ENGLISH ROSE ,2466
RED RETROSPOT SUGAR JAM BOWL,5558
RED RETROSPOT STORAGE JAR,6110
"SET 3 RETROSPOT TEA,COFFEE,SUGAR",1826
RED RETROSPOT TRADITIONAL TEAPOT ,1530
SET 10 LIGHTS NIGHT OWL,4911
BABUSHKA LIGHTS STRING OF 10,3028
SET/5 RED RETROSPOT LID GLASS BOWLS,5335
RED RETROSPOT STORAGE JAR,2485
ASSORTED COLOURS SILK FAN,1080
EDWARDIAN PARASOL NATURAL,6204
CARTOON  PENCIL SHARPENERS,2429
PARTY TIME PENCIL ERASERS,6223
SWIRLY CIRCULAR RUBBERS IN BAG,6280
BROCADE RING PURSE ,3980
ORIGAMI LAVENDER INCENSE/CANDL SET ,1524
ORIGAMI OPIUM INCENSE/CANDLE SET ,3502
ORIGAMI SANDLEWOOD INCENSE/CAND SET,1065
PORCELAIN BUTTERFLY OIL BURNER,1518
BLUE POLKADOT PASSPORT COVER,5060
VIPPASSPORT COVER ,1157
RED RETROSPOT PURSE ,4438
RED RETROSPOT BOWL,4074
FLORAL SOFT CAR TOY,6418
MOUSEY LONG LEGS SOFT TOY,1421
JUMBO BAG OWLS,3147
PARTY FOOD SHOPPER BAG,3093
STRAWBERRY SHOPPER BAG,1979
RED RETROSPOT SHOPPER BAG,3744
WOODLAND CHARLOTTE BAG,6865
STRAWBERRY CHARLOTTE BAG,5202
RED RETROSPOT CHARLOTTE BAG,1624
LUNCH BAG RED RETROSPOT,6661
LUNCH BAG WOODLAND,4771
LUNCH BAG  BLACK SKULL.,5800
BLACK MINI TAPE MEASURE ,1301
FUNKY WASHING UP GLOVES ASSORTED,2652
RETROSPOT RED WASHING UP GLOVES,4622
CAMOUFLAGE EAR MUFF HEADPHONES,2674
ZINC HEART LATTICE T-LIGHT HOLDER,1264
ZINC HEART LATTICE CHARGER LARGE,2071
SET/5 RED RETROSPOT LID GLASS BOWLS,1652
FORKED CACTUS CANDLE,2132
PORCELAIN T-LIGHT HOLDERS ASSORTED,3348
STRAWBERRY BATH SPONGE ,5227
APPLE BATH SPONGE,4085
SANDWICH BATH SPONGE,6971
RED FLORAL FELTCRAFT SHOULDER BAG,2626
PINK BLUE FELT CRAFT TRINKET BOX,5803
PINK CREAM FELT CRAFT TRINKET BOX ,6359
12 PENCIL SMALL TUBE WOODLAND,6304
12 PENCILS SMALL TUBE SKULL,4579
12 PENCILS SMALL TUBE RED RETROSPOT,5268
HEART CALCULATOR,6246
SWISS CHALET TREE DECORATION ,4975
DARK BIRD HOUSE TREE DECORATION,2549
SPACE OWL,4959
SET/2 RED RETROSPOT TEA TOWELS ,2055
RED RETROSPOT SHOPPING BAG,3022
RED RETROSPOT OVEN GLOVE DOUBLE,4917
VINTAGE BILLBOARD LOVE/HATE MUG,3132
VINTAGE BILLBOARD TEA MUG,2806
VINTAGE BILLBOARD MUG ,3289
VINTAGE BILLBOARD DRINK ME MUG,1414
CHRISTMAS TOILET ROLL,6913
FAIRY CAKE FLANNEL ASSORTED COLOUR,2806
"SWISS ROLL TOWEL, PINK  SPOTS",4383
ROSE CARAVAN DOORSTOP,3439
BLACK RECORD COVER FRAME,1897
JINGLE BELLS TREE DECORATION,4088
RED RETROSPOT OVEN GLOVE ,5011
BEWARE OF THE CAT METAL SIGN ,3074
COOK WITH WINE METAL SIGN ,6601
YOU'RE CONFUSING ME METAL SIGN ,5968
POTTERING IN THE SHED METAL SIGN,4142
GIN + TONIC DIET METAL SIGN,5622
PLEASE ONE PERSON METAL SIGN,6094
WHITE BELL HONEYCOMB PAPER GARLAND ,6038
LARGE WHITE HONEYCOMB PAPER BELL  ,1040
PACK OF 72 RETROSPOT CAKE CASES,4961
PACK OF 72 SKULL CAKE CASES,4117
RED RETROSPOT ROUND CAKE TINS,2120
RED SPOTTY BISCUIT TIN,1684
SET/4 BADGES BALLOON GIRL,2071
SET/4 BADGES DOGS,4004
SET/4 SKULL BADGES,2166
SWEETHEART CERAMIC TRINKET BOX,6467
STRAWBERRY CERAMIC TRINKET BOX,4108
RED RETROSPOT CUP,4616
WOODLAND  HEIGHT CHART STICKERS ,1199
WHITE GOOSE FEATHER CHRISTMAS TREE ,4796
SALLE DE BAIN HOOK,1865
VINTAGE KITCHEN PRINT FRUITS,3939
SMALL POLKADOT CHOCOLATE GIFT BAG ,3221
GLASS HEART T-LIGHT HOLDER ,4876
SMALL GLASS HEART TRINKET POT,1539
GLASS CHALICE GREEN  SMALL ,5546
AGED GLASS SILVER T-LIGHT HOLDER,1785
BALLOONS  WRITING SET ,2838
EUCALYPTUS & PINECONE  WREATH,5783
TOAST ITS - I LOVE YOU ,1069
TOAST ITS - FAIRY FLOWER,4109
RELAX LARGE WOOD LETTERS,2667
IVORY HANGING DECORATION  HEART,4229
BLUE POLKADOT EGG CUP ,3092
BROWN CHECK CAT DOORSTOP ,6315
SPOTTY PINK DUCK DOORSTOP,3040
RED GINGHAM ROSE JEWELLERY BOX,5479
WHITE SKULL HOT WATER BOTTLE ,4378
FAWN BLUE HOT WATER BOTTLE,4566
CHICK GREY HOT WATER BOTTLE,4105
RETROSPOT HEART HOT WATER BOTTLE,1375
PINK HEART DOTS HOT WATER BOTTLE,4838
RED WHITE SCARF  HOT WATER BOTTLE,1129
ROTATING LEAVES T-LIGHT HOLDER,4890
"FANCY FONT BIRTHDAY CARD, ",2102
SAVE THE PLANET COTTON TOTE BAG,6739
VINTAGE UNION JACK PENNANT,3502
ELEPHANT CARNIVAL POUFFE,6563
VINTAGE PINK DECORATIVE PARASOL,1856
ASSORTED TUTTI FRUTTI KEYRING BALL,4487
ASSORTED TUTTI FRUTTI BRACELET,3508
BLUE STRIPE CERAMIC DRAWER KNOB,6046
BUTTERFLIES STICKERS,1933
HEARTS  STICKERS,4797
PAISLEY PATTERN  STICKERS,5540
SKULLS  STICKERS,3241
SILVER PLATE CANDLE BOWL SMALL,3318
BAG 125g SWIRLY MARBLES,6942
BAG 250g SWIRLY MARBLES,2842
BOYS VINTAGE TIN SEASIDE BUCKET,3187
CANDY SHOP  STICKER SHEET,5431
SWEETIES  STICKERS,3760
MULTI HEARTS  STICKERS,3888
RED TOADSTOOL LED NIGHT LIGHT,2242
RED HANGING HEART T-LIGHT HOLDER,3621
COSY SLIPPER SHOES SMALL  RED ,5874
STAR PORTABLE TABLE LIGHT ,6355
DECORATIVE CATS BATHROOM BOTTLE,6494
RECIPE BOX WITH METAL HEART,3245
POLKADOT RAIN HAT ,3062
VINTAGE SNAP CARDS,4809
VINTAGE HEADS AND TAILS CARD GAME ,1049
CHRISTMAS TREE DECORATION WITH BELL,3391
CHRISTMAS TREE HEART DECORATION,1352
CHRISTMAS TREE STAR DECORATION,6718
CHRISTMAS HANGING TREE WITH BELL,1420
CHRISTMAS HANGING STAR WITH BELL,6259
CHRISTMAS HANGING HEART WITH BELL,4617
GARLAND WITH STARS AND BELLS,3141
GLITTER STAR GARLAND WITH BELLS ,3404
PAINTED METAL HEART WITH HOLLY BELL,2960
PAINTED METAL STAR WITH HOLLY BELLS,1730
EIGHT PIECE DINOSAUR SET,2206
CHOCOLATE CALCULATOR,5400
PINK DIAMANTE PEN IN GIFT BOX,2239
LILAC DIAMANTE PEN IN GIFT BOX,4327
POTTING SHED TEA MUG,1701
I CAN ONLY PLEASE ONE PERSON MUG,3910
SAVE THE PLANET MUG,5734
GIN AND TONIC MUG,5385
POTTERING MUG,3561
SKULLS TAPE,6110
CAKES AND BOWS GIFT  TAPE,6246
WOODEN BOX OF DOMINOES,1552
TRADITIONAL WOODEN SKIPPING ROPE,4895
POTTING SHED SEED ENVELOPES,3758
POTTING SHED TWINE,3944
"KEY FOB , SHED",1698
MAN FLU METAL SIGN,4558
PHARMACIE FIRST AID TIN,4985
CHOCOLATE THIS WAY METAL SIGN,6121
VINTAGE SNAKES & LADDERS,6756
RED  HARMONICA IN BOX ,2302
SET 12 RETRO WHITE CHALK STICKS,1290
SET 12 KIDS  WHITE CHALK STICKS,4896
SET 12 KIDS COLOUR  CHALK STICKS,5463
JUMBO BAG SCANDINAVIAN PAISLEY,5901
JUMBO BAG PINK VINTAGE PAISLEY,5052
SKULL SHOULDER BAG,4333
SUKI  SHOULDER BAG,4864
RED RETROSPOT PICNIC BAG,6261
STRAWBERRY   PICNIC BAG,1693
SKULLS DESIGN FLANNEL,5425
STRAWBERRIES  DESIGN FLANNEL ,4543
PACK OF 12 SKULL TISSUES,2082
SET OF 36 PAISLEY FLOWER DOILIES,6946
PACK OF 60 PINK PAISLEY CAKE CASES,1060
PACK OF 12 SUKI TISSUES ,6909
PACK OF 12 BLUE PAISLEY TISSUES ,6261
PACK OF 12 PINK PAISLEY TISSUES ,6594
PACK OF 12 HEARTS DESIGN TISSUES ,6955
PACK OF 12 PINK POLKADOT TISSUES,6462
MODERN FLORAL STATIONERY SET,5998
VINTAGE PAISLEY STATIONERY SET,6467
FLORAL FOLK STATIONERY SET,1904
PENNY FARTHING BIRTHDAY CARD,1716
CHRISTMAS PUDDING TRINKET POT ,5307
BLACK PIRATE TREASURE CHEST,1732
6 RIBBONS RUSTIC CHARM,1100
RIBBON REEL HEARTS DESIGN ,1056
RIBBON REEL POLKADOTS ,3668
RIBBON REEL FLORA + FAUNA ,2108
RIBBON REEL STRIPES DESIGN ,6853
PAPER CHAIN KIT RETROSPOT,2405
PAPER CHAIN KIT EMPIRE,6377
PAPER CHAIN KIT 50'S CHRISTMAS ,4780
PINK PAISLEY SQUARE TISSUE BOX ,1932
SKULLS SQUARE TISSUE BOX,1992
MIRROR MOSAIC HURRICANE LAMP ,2695
PIZZA PLATE IN BOX,5279
PING! MICROWAVE PLATE,2149
FULL ENGLISH BREAKFAST PLATE,1433
BIRD HOUSE HOT WATER BOTTLE,3413
CHOCOLATE HOT WATER BOTTLE,4315
GREY HEART HOT WATER BOTTLE,6225
HOT WATER BOTTLE TEA AND SYMPATHY,5798
METAL SIGN HIS DINNER IS SERVED,2560
SET OF 2 TEA TOWELS PING MICROWAVE,3233
FOOD CONTAINER SET 3 LOVE HEART ,2399
RED LOVE HEART SHAPE CUP,3085
PINK LOVE HEART SHAPE CUP,5827
LADLE LOVE HEART RED ,4932
LADLE LOVE HEART PINK,3439
LOVE HEART SOCK HANGER,4417
CHRISTMAS CRAFT TREE TOP ANGEL,2585
CHRISTMAS CRAFT WHITE FAIRY ,5017
CHRISTMAS CRAFT LITTLE FRIENDS,3250
FELTCRAFT BUTTERFLY HEARTS,3803
FELTCRAFT 6 FLOWER FRIENDS,4668
3 STRIPEY MICE FELTCRAFT,2153
PLACE SETTING WHITE HEART,3486
ANGEL DECORATION STARS ON DRESS,3646
ANGEL DECORATION 3 BUTTONS ,3198
STAR DECORATION RUSTIC,3188
HEART DECORATION WITH PEARLS ,2332
HEART DECORATION RUSTIC HANGING ,2733
HEART GARLAND RUSTIC PADDED,5782
HEART STRING MEMO HOLDER HANGING,3938
"DIAMANTE HEART SHAPED WALL MIRROR, ",3436
 OVAL WALL MIRROR DIAMANTE ,6757
FAMILY ALBUM WHITE PICTURE FRAME,5765
VICTORIAN GLASS HANGING T-LIGHT,1306
SET 10 LIGHTS NIGHT OWL,6750
CAKE STAND VICTORIAN FILIGREE MED,1394
CAKE STAND VICTORIAN FILIGREE LARGE,5444
GREEN CHRISTMAS TREE CARD HOLDER,5685
CREAM HEART CARD HOLDER,3043
LOCAL CAFE MUG,5661
LARGE HEART MEASURING SPOONS,6650
SMALL HEART MEASURING SPOONS,1768
SMALL POPCORN HOLDER,3100
LARGE POPCORN HOLDER ,2257
FRYING PAN UNION FLAG,1522
WOOD STAMP SET THANK YOU,1271
FOUR HOOK  WHITE LOVEBIRDS,5604
LOVEBIRD HANGING DECORATION WHITE ,5761
CAKE STAND LOVEBIRD 2 TIER PINK,6273
CAKE PLATE LOVEBIRD PINK,6814
WHITE LOVEBIRD LANTERN,1760
HANGING HEART MIRROR DECORATION ,4385
5 HOOK HANGER MAGIC TOADSTOOL,3322
FELT TOADSTOOL  SMALL,3631
FELT EGG COSY BLUE RABBIT ,3294
FELT EGG COSY WHITE RABBIT ,2070
FELT EGG COSY CHICKEN,1267
FELTCRAFT DOLL ROSIE,6208
FELTCRAFT DOLL MOLLY,5459
12 EGG HOUSE PAINTED WOOD,5323
"DECORATION HEN ON NEST, HANGING",3474
HEART IVORY TRELLIS SMALL,6407
COFFEE MUG CAT + BIRD DESIGN,1986
IVORY KNITTED MUG COSY ,4167
OFFICE MUG WARMER BLACK+SILVER ,6160
OFFICE MUG WARMER POLKADOT,2470
OFFICE MUG WARMER CHOC+BLUE,6265
FIVE HEART HANGING DECORATION,6375
BIRD DECORATION RED RETROSPOT,5705
ROUND SNACK BOXES SET OF4 WOODLAND ,3105
ROUND SNACK BOXES SET OF 4 FRUITS ,4428
ROUND CONTAINER SET OF 5 RETROSPOT,5551
HEART DECORATION PAINTED ZINC ,4888
DOVE DECORATION PAINTED ZINC ,5294
ANGEL DECORATION PAINTED ZINC ,5967
HOME GARLAND PAINTED ZINC ,1377
PARTY PIZZA DISH PINK POLKADOT,2395
PARTY PIZZA DISH BLUE POLKADOT,3214
TEA BAG PLATE RED RETROSPOT,3890
CHARLOTTE BAG SUKI DESIGN,2341
KINGS CHOICE TEA CADDY ,5370
GLASS JAR ENGLISH CONFECTIONERY,4133
AIRLINE BAG VINTAGE TOKYO 78,1677
AIRLINE BAG VINTAGE JET SET BROWN,3665
RECYCLING BAG RETROSPOT ,1821
TOY TIDY SPACEBOY  ,6004
LUNCH BAG SPACEBOY DESIGN ,3135
LUNCH BAG SUKI  DESIGN ,3986
PAPERWEIGHT VINTAGE COLLAGE,3439
PAPERWEIGHT VINTAGE PAISLEY,3807
MAGNETS PACK OF 4 SWALLOWS,3893
MAGNETS PACK OF 4 VINTAGE LABELS ,1587
MONEY BOX BISCUITS DESIGN,4630
JUMBO SHOPPER VINTAGE RED PAISLEY,4240
METAL SIGN TAKE IT OR LEAVE IT ,4611
SET OF 36 DOILIES SPACEBOY DESIGN ,3477
PACK OF 60 SPACEBOY CAKE CASES,4515
LIPSTICK PEN RED,3637
TOOTHPASTE TUBE PEN,5176
REGENCY CAKESTAND 3 TIER,2819
GROW YOUR OWN PLANT IN A CAN ,5013
SILK PURSE BABUSHKA RED,6528
NATURAL SLATE CHALKBOARD LARGE ,6441
NATURAL SLATE HEART CHALKBOARD ,6450
CAST IRON HOOK GARDEN FORK,2855
CAST IRON HOOK GARDEN TROWEL,4645
SAVOY ART DECO CLOCK,5646
HANGING METAL HEART LANTERN,5681
HANGING METAL STAR LANTERN,3119
HEART OF WICKER SMALL,2231
HEART OF WICKER LARGE,2361
SKULL DESIGN TV DINNER TRAY,4642
EMPIRE UNION JACK TV DINNER TRAY,5262
EMERGENCY FIRST AID TIN ,2460
PICNIC BASKET WICKER LARGE,5854
PICNIC BASKET WICKER SMALL,1980
MEMO BOARD COTTAGE DESIGN,5838
MAGIC DRAWING SLATE DOLLY GIRL ,3603
MAGIC DRAWING SLATE CIRCUS PARADE  ,1175
MAGIC DRAWING SLATE SPACEBOY ,6600
MINI JIGSAW SPACEBOY,2322
HOLIDAY FUN LUDO,4957
PLASTERS IN TIN SKULLS,3618
PLASTERS IN TIN CIRCUS PARADE ,2616
PLASTERS IN TIN VINTAGE PAISLEY ,6656
CLOTHES PEGS RETROSPOT PACK 24 ,1590
HAPPY STENCIL CRAFT,3343
20 DOLLY PEGS RETROSPOT,6521
FELTCRAFT CUSHION OWL,6064
FELTCRAFT CUSHION BUTTERFLY,1747
FELTCRAFT CUSHION RABBIT,2195
ROCKING HORSE RED CHRISTMAS ,5337
ROCKING HORSE GREEN CHRISTMAS ,4155
STAR WOODEN CHRISTMAS DECORATION,6405
HEART WOODEN CHRISTMAS DECORATION,6443
WOODEN STAR CHRISTMAS SCANDINAVIAN,5332
WOOD STOCKING CHRISTMAS SCANDISPOT,4600
PACK OF 6 SWEETIE GIFT BOXES,4062
CARD HOLDER GINGHAM HEART,3898
CARDHOLDER HOLLY WREATH METAL,2422
CHRISTMAS GINGHAM STAR,2263
CHRISTMAS GINGHAM TREE,1496
CHRISTMAS GINGHAM HEART,1649
CHRISTMAS RETROSPOT ANGEL WOOD,5039
CHRISTMAS RETROSPOT HEART WOOD,6270
CHRISTMAS RETROSPOT TREE WOOD,5654
PENS ASSORTED SPACEBALL,1638
PACK OF 20 SPACEBOY NAPKINS,4548
PACK OF 12 LONDON TISSUES ,4627
SET OF 6 SOLDIER SKITTLES,1337
BOX OF VINTAGE ALPHABET BLOCKS,2442
IVORY KITCHEN SCALES,1350
RED KITCHEN SCALES,2835
MINT KITCHEN SCALES,6762
SPACEBOY LUNCH BOX ,3556
HAND WARMER RED RETROSPOT,3135
HAND WARMER UNION JACK,6452
SET OF 4 NAPKIN CHARMS HEARTS,1291
CERAMIC CHERRY CAKE MONEY BANK,6029
CERAMIC HEART FAIRY CAKE MONEY BANK,2040
CERAMIC STRAWBERRY CAKE MONEY BANK,3768
STRAWBERRY FAIRY CAKE TEAPOT,4925
GENTLEMAN SHIRT REPAIR KIT ,3668
TRAVEL SEWING KIT,2660
DELUXE SEWING KIT ,5116
CHARLOTTE BAG DOLLY GIRL DESIGN,4317
RECIPE BOX BLUE SKETCHBOOK DESIGN,3383
RECIPE BOX PANTRY YELLOW DESIGN,3395
PINK BABY BUNTING,2962
FRENCH WC SIGN BLUE METAL,4387
FRENCH BLUE METAL DOOR SIGN 3,4305
FRENCH BLUE METAL DOOR SIGN 9,5563
WICKER STAR ,3397
WICKER WREATH SMALL,2789
GREEN REGENCY TEACUP AND SAUCER,2382
ROSES REGENCY TEACUP AND SAUCER ,6040
CARD DOG AND BALL ,6361
ALARM CLOCK BAKELIKE CHOCOLATE,2953
ALARM CLOCK BAKELIKE GREEN,1849
ALARM CLOCK BAKELIKE PINK,4564
ALARM CLOCK BAKELIKE ORANGE,6770
ALARM CLOCK BAKELIKE IVORY,4365
3D VINTAGE CHRISTMAS STICKERS ,1907
RIBBON REEL SOCKS AND MITTENS,2814
RIBBON REEL MAKING SNOWMEN ,3325
RIBBON REEL CHRISTMAS PRESENT ,4750
RIBBON REEL SNOWY VILLAGE,2700
RIBBON REEL CHRISTMAS SOCK BAUBLE,2581
POLKADOT PEN,6696
FUNKY DIVA PEN,3202
MAKE YOUR OWN FLOWERPOWER CARD KIT,5328
POPPY'S PLAYHOUSE BEDROOM ,1022
POPPY'S PLAYHOUSE KITCHEN,4135
FELTCRAFT PRINCESS LOLA DOLL,3039
SMALL RED BABUSHKA NOTEBOOK ,4044
LARGE RED BABUSHKA NOTEBOOK ,5938
SET OF 3 NOTEBOOKS IN PARCEL,1985
PHOTO FRAME CORNICE,4612
BROCANTE COAT RACK,5256
T-LIGHT GLASS FLUTED ANTIQUE,1447
FLUTED ANTIQUE CANDLE HOLDER,5593
ANTIQUE GLASS DRESSING TABLE POT,5180
ANTIQUE TALL SWIRLGLASS TRINKET POT,4424
ANTIQUE GLASS PEDESTAL BOWL,1190
BLUE DRAWER KNOB ACRYLIC EDWARDIAN,1509
SET OF 6 T-LIGHTS TOADSTOOLS,6190
SET OF 6 T-LIGHTS SNOWMEN,5598
SET OF 6 T-LIGHTS CACTI ,6732
PACK 3 BOXES CHRISTMAS PANNETONE,5906
HAND WARMER BABUSHKA DESIGN,2246
HOT WATER BOTTLE I AM SO POORLY,5673
HOT WATER BOTTLE BABUSHKA ,2802
ROUND CAKE TIN VINTAGE GREEN,6277
SET 20 NAPKINS FAIRY CAKES DESIGN ,6253
LOVE HEART NAPKIN BOX ,1619
HAND WARMER OWL DESIGN,6506
HAND WARMER SCOTTY DOG DESIGN,4690
HAND WARMER BIRD DESIGN,2977
TEA FOR ONE POLKADOT,1771
MINI CAKE STAND T-LIGHT HOLDER,3645
CALENDAR PAPER CUT DESIGN,1426
12 MESSAGE CARDS WITH ENVELOPES,6926
SET OF 20 VINTAGE CHRISTMAS NAPKINS,1745
PAPER CHAIN KIT VINTAGE CHRISTMAS,1822
YELLOW COAT RACK PARIS FASHION,3538
ASSORTED BOTTLE TOP  MAGNETS ,5224
HERB MARKER THYME,5011
HERB MARKER ROSEMARY,3945
HERB MARKER PARSLEY,5259
HERB MARKER MINT,4945
HERB MARKER BASIL,3588
HERB MARKER CHIVES ,1560
FRIDGE MAGNETS LA VIE EN ROSE,3424
FELTCRAFT CHRISTMAS FAIRY,4598
CHRISTMAS LIGHTS 10 REINDEER,3496
CHRISTMAS METAL TAGS ASSORTED ,3197
36 DOILIES DOLLY GIRL,4349
60 CAKE CASES DOLLY GIRL DESIGN,1240
60 CAKE CASES VINTAGE CHRISTMAS,6325
36 FOIL STAR CAKE CASES ,2721
JAM MAKING SET WITH JARS,5220
JAM MAKING SET PRINTED,3606
JAM JAR WITH PINK LID,4523
JAM JAR WITH GREEN LID,2118
ROSE COTTAGE KEEPSAKE BOX ,1478
HOMEMADE JAM SCENTED CANDLES,6226
CHILDREN'S SPACEBOY MUG,5801
CHILDRENS DOLLY GIRL MUG,4795
CARD BILLBOARD FONT,5026
SOLDIERS EGG CUP ,4445
PINK/WHITE CHRISTMAS TREE 60CM,4714
PINK AND WHITE CHRISTMAS TREE 120CM,5062
VINTAGE BEAD PINK PURSE ,2952
VINTAGE BEAD PINK SCARF ,4494
VINTAGE BEAD NOTEBOOK,2736
SMALL FOLKART STAR CHRISTMAS DEC,5600
SMALLFOLKART BAUBLE CHRISTMAS DEC,4684
FOLKART ZINC HEART CHRISTMAS DEC,6091
FOLKART HEART NAPKIN RINGS,4266
FOLK ART METAL STAR T-LIGHT HOLDER,5161
ROSE FOLKART HEART DECORATIONS,2801
RETRO COFFEE MUGS ASSORTED,4593
PINK BREAKFAST CUP AND SAUCER ,2392
CERAMIC CAKE DESIGN SPOTTED PLATE,2596
FUNKY MONKEY CUSHION COVER,2446
WOVEN FROST CUSHION COVER,6835
WOVEN CANDY CUSHION COVER ,3161
RETRO LONGBOARD IRONING BOARD COVER,5743
TEA TIME DES TEA COSY,4555
SCOTTIES CHILDRENS APRON,2060
SCOTTIE DOGS BABY BIB,1669
DOORMAT ENGLISH ROSE ,2263
DOORMAT HEARTS,6780
"FEATHER PEN,COAL BLACK",6503
TURQ ICE CREAM BUM BAG ,2130
LOVE HEART POCKET WARMER,5920
WHITE METAL LANTERN,1976
COLOUR GLASS. STAR T-LIGHT HOLDER,4223
SET/3 ROSE CANDLE IN JEWELLED BOX,2549
SET/3 CHRISTMAS DECOUPAGE CANDLES,6435
SET OF 2 CHRISTMAS DECOUPAGE CANDLE,6149
RETRO MOD TRAY,1714
"ART LIGHTS,FUNK MONKEY",3055
CHILLI LIGHTS,1055
VINYL RECORD FRAME SILVER,2460
WOOD BLACK BOARD ANT WHITE FINISH,6864
WOOD S/3 CABINET ANT WHITE FINISH,3073
"AIRLINE LOUNGE,METAL SIGN",6157
BATHROOM METAL SIGN,3996
AREA PATROLLED METAL SIGN,4236
FANNY'S REST STOPMETAL SIGN,6193
METAL SIGN CUPCAKE SINGLE HOOK,2636
FRAPPUCINO SCARF KNITTING KIT,2615
MAGIC TREE -PAPER FLOWERS,2862
KNITTED UNION FLAG HOT WATER BOTTLE,5640
CHARLIE+LOLA RED HOT WATER BOTTLE ,4443
CHARLIE LOLA BLUE HOT WATER BOTTLE ,3099
CHARLIE+LOLA PINK HOT WATER BOTTLE,4603
CHARLIE + LOLA RED HOT WATER BOTTLE,5518
PINK HEART SHAPE EGG FRYING PAN,5069
WORLD WAR 2 GLIDERS ASSTD DESIGNS,6124
SET/4 WHITE RETRO STORAGE CUBES ,4022
HEN HOUSE W CHICK STANDING,1515
ASSTD DESIGN BUBBLE GUM RING,2261
SMALL PINK MAGIC CHRISTMAS TREE,3233
ROTATING SILVER ANGELS T-LIGHT HLDR,1494
SET OF 3 HEART COOKIE CUTTERS,6566
SET OF 3 BUTTERFLY COOKIE CUTTERS,4836
YELLOW METAL CHICKEN HEART ,5764
ENGLISH ROSE NOTEBOOK A7 SIZE,5534
FAIRY CAKES NOTEBOOK A7 SIZE,2203
3D DOG PICTURE PLAYING CARDS,5871
3D SHEET OF CAT STICKERS,5488
GIRLS ALPHABET IRON ON PATCHES ,6295
MIXED NUTS LIGHT GREEN BOWL,3221
WHITE TRAVEL ALARM CLOCK,4507
BEACH HUT KEY CABINET,2273
ZINC FINISH 15CM PLANTER POTS,3974
ENCHANTED BIRD PLANT CAGE,6207
SET OF 4 DIAMOND NAPKIN RINGS,3458
JUNGLE POPSICLES ICE LOLLY HOLDERS,4444
ZINC METAL HEART DECORATION,6859
FAIRY SOAP SOAP HOLDER,5709
