ProductName,Price
PACK OF 12 SKULL TISSUES,5757
RED POLKADOT PUDDING BOWL,1204
BLUE POLKADOT PUDDING BOWL,1973
ROUND SNACK BOXES SET OF 4 FRUITS ,5165
60 CAKE CASES VINTAGE CHRISTMAS,6151
VINTAGE BLUE TINSEL REEL,3264
TOTE BAG I LOVE LONDON,6382
LUNCH BOX I LOVE LONDON,5153
MIRROR LOVE BIRD T-LIGHT HOLDER,5052
BLACK LOVE BIRD T-LIGHT HOLDER,4808
JARDIN ETCHED GLASS BUTTER DISH,2285
DISCO BALL CHRISTMAS DECORATION,5346
PAPER BUNTING WHITE LACE,4079
SKULLS WRITING SET ,5912
BALLOONS  WRITING SET ,5783
SPACE FROG,4796
SPACE CADET BLACK,2161
SPACE CADET RED,6211
SPACE OWL,1117
AIRLINE BAG VINTAGE JET SET WHITE,2439
SPACE CADET WHITE,3329
AIRLINE BAG VINTAGE JET SET WHITE,4083
PLASTERS IN TIN WOODLAND ANIMALS,1349
PLASTERS IN TIN SKULLS,4371
SPACE OWL,5180
WOODLAND DESIGN  COTTON TOTE BAG,1246
STRAWBERRY LUNCH BOX WITH CUTLERY,5250
T-LIGHT GLASS FLUTED ANTIQUE,3610
RED POLKADOT PUDDING BOWL,4055
BLUE POLKADOT PUDDING BOWL,2970
PACK OF 6 BIRDY GIFT TAGS,2421
ILLUSTRATED CAT BOWL ,4494
TOAST ITS - BEST MUM,4058
TOAST ITS - DINOSAUR,4993
SET OF 20 VINTAGE CHRISTMAS NAPKINS,2098
DOLLY GIRL CHILDRENS EGG CUP,4260
CHILDRENS DOLLY GIRL MUG,5752
RED RETROSPOT CHARLOTTE BAG,5738
WOODLAND CHARLOTTE BAG,6688
COSY HOUR GIANT TUBE MATCHES,1978
VINTAGE UNION JACK APRON,6530
CHILDS BREAKFAST SET SPACEBOY ,2749
GARDEN PATH SKETCHBOOK,2970
CHILDREN'S SPACEBOY MUG,4548
SOLDIERS EGG CUP ,5108
CIRCUS PARADE CHILDRENS EGG CUP ,6958
CHILDREN'S CIRCUS PARADE MUG,4350
ASSORTED COLOUR BIRD ORNAMENT,5956
RED POLKADOT COFFEE  MUG,2356
BLUE POLKADOT COFFEE MUG,4269
PACK OF 6 BIRDY GIFT TAGS,4454
PACK OF 12 SUKI TISSUES ,2623
BOX OF VINTAGE JIGSAW BLOCKS ,5441
SET OF 20 VINTAGE CHRISTMAS NAPKINS,5504
MONSTERS STENCIL CRAFT,6253
PACK OF 12 SKULL TISSUES,1069
12 MESSAGE CARDS WITH ENVELOPES,4213
SET/12 TAPER CANDLES,5321
COSY HOUR CIGAR BOX MATCHES ,6974
CITRONELLA CANDLE GARDEN POT,3362
ZINC WILLIE WINKIE  CANDLE STICK,6506
PLASTERS IN TIN SKULLS,5664
PACK OF 12 SKULL TISSUES,2544
PACK OF 12 PINK PAISLEY TISSUES ,2045
PACK OF 12 SUKI TISSUES ,4470
PACK OF 12 WOODLAND TISSUES ,4008
COSY HOUR CIGAR BOX MATCHES ,3262
VICTORIAN  METAL POSTCARD SPRING,5893
ASSORTED COLOUR BIRD ORNAMENT,4094
SET/10 RED POLKADOT PARTY CANDLES,3113
MODERN FLORAL STATIONERY SET,2944
BALLOONS  WRITING SET ,6065
SKULLS WRITING SET ,6514
MAKE YOUR OWN MONSOON CARD KIT,3318
FUNKY WASHING UP GLOVES ASSORTED,2136
FLORAL FOLK STATIONERY SET,2013
6 RIBBONS RUSTIC CHARM,5216
SWIRLY CIRCULAR RUBBERS IN BAG,1637
SET OF 9 HEART SHAPED BALLOONS,3974
ROTATING SILVER ANGELS T-LIGHT HLDR,5451
RIBBON REEL STRIPES DESIGN ,6010
WOODLAND DESIGN  COTTON TOTE BAG,3007
60 CAKE CASES VINTAGE CHRISTMAS,1922
PACK OF 12 LONDON TISSUES ,4388
WOODEN SCHOOL COLOURING SET,1331
SUKI  SHOULDER BAG,5485
WOODEN SCHOOL COLOURING SET,2975
BLUE POLKADOT WASHING UP GLOVES,6211
CHICK GREY HOT WATER BOTTLE,6910
COSY HOUR GIANT TUBE MATCHES,3140
CHILDS BREAKFAST SET CIRCUS PARADE,2044
PLASTERS IN TIN STRONGMAN,3448
PLASTERS IN TIN VINTAGE PAISLEY ,6736
TRADITIONAL WOODEN CATCH CUP GAME ,4559
SET OF 6 SOLDIER SKITTLES,6301
WOODLAND CHARLOTTE BAG,2336
LUNCH BAG CARS BLUE,1790
BAKING SET SPACEBOY DESIGN,3697
POPPY'S PLAYHOUSE BEDROOM ,1842
POPPY'S PLAYHOUSE KITCHEN,1349
WOODLAND STORAGE BOX SMALL,4917
CHILDS BREAKFAST SET DOLLY GIRL ,6115
SAVE THE PLANET COTTON TOTE BAG,1063
SET OF 72 GREEN PAPER DOILIES,4949
SET/3 RED GINGHAM ROSE STORAGE BOX,1562
WOODEN ROUNDERS GARDEN SET ,3172
CHILDREN'S APRON DOLLY GIRL ,6016
36 PENCILS TUBE WOODLAND,4116
36 PENCILS TUBE RED RETROSPOT,6361
CHARLOTTE BAG DOLLY GIRL DESIGN,3895
TOTE BAG I LOVE LONDON,6047
SKULLS  DESIGN  COTTON TOTE BAG,6392
FLOWER BURST SILVER RING CRYSTAL,2336
HAND WARMER RED RETROSPOT,2216
HAND WARMER SCOTTY DOG DESIGN,4155
HAND WARMER OWL DESIGN,1665
HAND WARMER UNION JACK,2343
PINK FLORAL FELTCRAFT SHOULDER BAG,4118
ENAMEL FLOWER JUG CREAM,4883
RETRO COFFEE MUGS ASSORTED,1756
HOME SWEET HOME MUG,1047
RETRO MOD TRAY,1730
ENAMEL BREAD BIN CREAM,3357
ENAMEL WASH BOWL CREAM,3933
ENAMEL MEASURING JUG CREAM,6497
ENAMEL FIRE BUCKET CREAM,2899
WASHROOM METAL SIGN,4242
LAUNDRY 15C METAL SIGN,1102
KITCHEN METAL SIGN,1080
TOILET METAL SIGN,5547
FANNY'S REST STOPMETAL SIGN,2970
GIN AND TONIC MUG,1318
GARDEN METAL SIGN ,2172
PLEASE ONE PERSON METAL SIGN,6998
CHOCOLATE THIS WAY METAL SIGN,2239
METAL SIGN TAKE IT OR LEAVE IT ,4711
YOU'RE CONFUSING ME METAL SIGN ,4209
HOT BATHS METAL SIGN,3849
"AIRLINE LOUNGE,METAL SIGN",2721
HOT BATHS METAL SIGN,3344
COOK WITH WINE METAL SIGN ,2425
"KEY FOB , BACK DOOR ",3041
"KEY FOB , GARAGE DESIGN",2498
GIN AND TONIC MUG,1882
POTTERING IN THE SHED METAL SIGN,2469
GIN + TONIC DIET METAL SIGN,4805
"KEY FOB , SHED",2857
"KEY FOB , FRONT  DOOR ",5934
DOORMAT UNION FLAG,3553
JUMBO STORAGE BAG SUKI,2059
JUMBO STORAGE BAG SKULLS,6804
JUMBO BAG RED RETROSPOT,5049
JUMBO BAG PINK POLKADOT,3557
12 PENCILS SMALL TUBE SKULL,5729
12 PENCIL SMALL TUBE WOODLAND,3147
12 PENCILS SMALL TUBE RED RETROSPOT,2976
HI TEC ALPINE HAND WARMER,4732
LOVE HEART POCKET WARMER,5796
CHRISTMAS TOILET ROLL,6314
POPPY'S PLAYHOUSE BEDROOM ,2874
POPPY'S PLAYHOUSE LIVINGROOM ,2045
POPPY'S PLAYHOUSE KITCHEN,1563
HAND WARMER BIRD DESIGN,3080
HAND WARMER RED RETROSPOT,1179
HAND WARMER BABUSHKA DESIGN,2601
HAND WARMER OWL DESIGN,4171
HAND WARMER SCOTTY DOG DESIGN,3230
JAM MAKING SET WITH JARS,5661
HOMEMADE JAM SCENTED CANDLES,5871
CARAVAN SQUARE TISSUE BOX,5728
CARD CAT AND TREE ,3164
CARD DOG AND BALL ,6414
RAINY LADIES BIRTHDAY CARD,1441
PENNY FARTHING BIRTHDAY CARD,5698
CARD CIRCUS PARADE,6629
PINK FAIRY CAKE CHILDRENS APRON,5041
TEA TIME KITCHEN APRON,2711
JAM MAKING SET PRINTED,6350
CARD PARTY GAMES ,1940
CARD BILLBOARD FONT,3972
BOTANICAL LAVENDER BIRTHDAY CARD,4418
RECYCLING BAG RETROSPOT ,7000
SET OF 3 HEART COOKIE CUTTERS,4689
ALARM CLOCK BAKELIKE RED ,6673
ALARM CLOCK BAKELIKE GREEN,4852
ALARM CLOCK BAKELIKE IVORY,2384
CHICK GREY HOT WATER BOTTLE,1471
VINTAGE RED TEATIME MUG,6352
VINTAGE HEADS AND TAILS CARD GAME ,5417
CHRISTMAS TOILET ROLL,3232
60 CAKE CASES VINTAGE CHRISTMAS,2039
PAPER CHAIN KIT 50'S CHRISTMAS ,5297
FANNY'S REST STOPMETAL SIGN,4156
GREY HEART HOT WATER BOTTLE,2352
FELTCRAFT PRINCESS LOLA DOLL,1696
FELTCRAFT PRINCESS CHARLOTTE DOLL,6079
FELTCRAFT CUSHION OWL,5377
SCOTTIE DOG HOT WATER BOTTLE,1817
STRAWBERRY LUNCH BOX WITH CUTLERY,4852
PICTURE DOMINOES,2441
RIBBON REEL SOCKS AND MITTENS,5338
CHRISTMAS LIGHTS 10 REINDEER,5542
RED TOADSTOOL LED NIGHT LIGHT,5898
HOT WATER BOTTLE BABUSHKA ,6307
SET 10 LIGHTS NIGHT OWL,4007
MIRRORED DISCO BALL ,4681
DISCO BALL ROTATOR BATTERY OPERATED,2364
WOODEN OWLS LIGHT GARLAND ,1447
GREY HEART HOT WATER BOTTLE,6886
GAOLERS KEYS DECORATIVE GARDEN ,6521
REGENCY CAKESTAND 3 TIER,5645
GLASS CLOCHE LARGE,1768
GLASS CLOCHE SMALL,2866
CHICK GREY HOT WATER BOTTLE,5518
RED WOOLLY HOTTIE WHITE HEART.,3590
KNITTED UNION FLAG HOT WATER BOTTLE,5489
RETRO COFFEE MUGS ASSORTED,4089
DOORMAT SPOTTY HOME SWEET HOME,6057
DOORMAT UNION FLAG,4182
IVORY GIANT GARDEN THERMOMETER,1020
DOORMAT RESPECTABLE HOUSE,6973
ROUND SNACK BOXES SET OF4 WOODLAND ,4977
ROUND SNACK BOXES SET OF 4 FRUITS ,1940
EDWARDIAN PARASOL RED,6110
EDWARDIAN PARASOL BLACK,3889
GLASS  BEURRE DISH,1691
CHRISTMAS PUDDING TRINKET POT ,5184
SOLDIERS EGG CUP ,2835
GREEN REGENCY TEACUP AND SAUCER,4473
ANTIQUE GLASS DRESSING TABLE POT,3864
ASSORTED COLOUR BIRD ORNAMENT,1993
ANTIQUE GLASS PEDESTAL BOWL,4263
ANTIQUE TALL SWIRLGLASS TRINKET POT,5294
CORONA MEXICAN TRAY,2348
KIDS RAIN MAC BLUE,1406
BIRD DECORATION RED RETROSPOT,6141
MINI PAINT SET VINTAGE ,4706
PINK BLUE FELT CRAFT TRINKET BOX,6476
PINK CREAM FELT CRAFT TRINKET BOX ,3923
12 PENCILS SMALL TUBE SKULL,4907
12 PENCIL SMALL TUBE WOODLAND,6362
WOODEN SCHOOL COLOURING SET,1920
PACK OF 12 COLOURED PENCILS,1923
PACK OF 12 TRADITIONAL CRAYONS,4759
ASSORTED COLOURS SILK FAN,6311
VINTAGE BILLBOARD TEA MUG,4868
RETRO COFFEE MUGS ASSORTED,5815
20 DOLLY PEGS RETROSPOT,5337
CLOTHES PEGS RETROSPOT PACK 24 ,6140
MONEY BOX CONFECTIONERY DESIGN,3506
MONEY BOX KINGS CHOICE DESIGN,1515
MONEY BOX POCKET MONEY DESIGN,5044
CHOCOLATE THIS WAY METAL SIGN,5809
HAND OVER THE CHOCOLATE   SIGN ,6769
CHRISTMAS TREE STAR DECORATION,3641
WOODEN TREE CHRISTMAS SCANDINAVIAN,6581
BATHROOM METAL SIGN,3446
TOILET METAL SIGN,3635
KITCHEN METAL SIGN,2633
PICNIC BASKET WICKER LARGE,4551
GLASS CLOCHE SMALL,6958
REGENCY CAKESTAND 3 TIER,6165
BREAD BIN DINER STYLE RED ,1334
RED HANGING HEART T-LIGHT HOLDER,6464
BLUE STRIPE CERAMIC DRAWER KNOB,2204
CHILDS BREAKFAST SET SPACEBOY ,1224
VICTORIAN SEWING BOX SMALL ,3947
VICTORIAN SEWING BOX MEDIUM,3020
FELTCRAFT CUSHION OWL,3521
FELTCRAFT CUSHION BUTTERFLY,4620
FELTCRAFT CUSHION RABBIT,6780
RED WOOLLY HOTTIE WHITE HEART.,4590
FAWN BLUE HOT WATER BOTTLE,1053
ASSORTED COLOUR T-LIGHT HOLDER,3336
CAMOUFLAGE LED TORCH,4410
WEEKEND BAG VINTAGE ROSE PAISLEY,4017
WOODEN STAR CHRISTMAS SCANDINAVIAN,6811
HEART WOODEN CHRISTMAS DECORATION,2297
CHRISTMAS GINGHAM STAR,6018
CHRISTMAS GINGHAM HEART,4950
CARD HOLDER GINGHAM HEART,5199
PARTY CONE CHRISTMAS DECORATION ,3039
CERAMIC CAKE BOWL + HANGING CAKES,5677
DISCO BALL CHRISTMAS DECORATION,1995
CARD CHRISTMAS VILLAGE,1520
CARD MOTORBIKE SANTA,3448
CHRISTMAS CARD SCREEN PRINT ,3331
CHRISTMAS CARD STACK OF PRESENTS,2952
CHRISTMAS CARD SINGING ANGEL,6155
YULETIDE IMAGES GIFT WRAP SET,1034
TRADITIONAL CHRISTMAS RIBBONS,3055
PAPER CHAIN KIT VINTAGE CHRISTMAS,6307
PAPER CHAIN KIT 50'S CHRISTMAS ,1413
SET/3 CHRISTMAS DECOUPAGE CANDLES,6055
SMALLFOLKART BAUBLE CHRISTMAS DEC,5582
BROCADE RING PURSE ,6762
PAPER BUNTING VINTAGE PAISLEY,4775
METAL SIGN TAKE IT OR LEAVE IT ,1176
POLYESTER FILLER PAD 40x40cm,5919
RED RETROSPOT TRADITIONAL TEAPOT ,1414
IVORY PILLAR CANDLE SILVER FLOCK,4574
CREAM SWEETHEART MINI CHEST,4863
KINGS CHOICE GIANT TUBE MATCHES,1581
VICTORIAN SEWING BOX LARGE,6376
CACTI T-LIGHT CANDLES,6869
VICTORIAN GLASS HANGING T-LIGHT,4177
SILVER FISHING GNOME ,2914
GREEN CHRISTMAS TREE CARD HOLDER,3418
COLOUR GLASS. STAR T-LIGHT HOLDER,2514
ANTIQUE SILVER TEA GLASS ENGRAVED,6571
ENAMEL FLOWER JUG CREAM,2859
GRAND CHOCOLATECANDLE,4831
CHILDRENS APRON APPLES DESIGN,6616
RECIPE BOX RETROSPOT ,5913
ROUND SNACK BOXES SET OF 4 FRUITS ,5657
"FANCY FONT BIRTHDAY CARD, ",3368
GIN & TONIC DIET GREETING CARD ,5273
PACK OF 72 SKULL CAKE CASES,2412
PARTY INVITES JAZZ HEARTS,5149
PARTY INVITES DINOSAURS,2360
SET OF 20 KIDS COOKIE CUTTERS,3398
RED KITCHEN SCALES,2084
IVORY KITCHEN SCALES,6745
SOLDIERS EGG CUP ,6196
PACK OF 60 DINOSAUR CAKE CASES,1340
SET/5 RED RETROSPOT LID GLASS BOWLS,6165
ENAMEL MEASURING JUG CREAM,3722
NUMBER TILE COTTAGE GARDEN 9,4065
NUMBER TILE COTTAGE GARDEN 1,2166
NUMBER TILE COTTAGE GARDEN No,5524
RED RETROSPOT CAKE STAND,6204
DOLLY GIRL LUNCH BOX,5198
HAND WARMER BIRD DESIGN,2516
ROTATING LEAVES T-LIGHT HOLDER,3615
SET/6 RED SPOTTY PAPER PLATES,1897
GENTLEMAN SHIRT REPAIR KIT ,2934
SET/20 RED RETROSPOT PAPER NAPKINS ,3217
TRAVEL SEWING KIT,3576
RED RETROSPOT ROUND CAKE TINS,2774
PICNIC BASKET WICKER SMALL,6942
ENAMEL WATERING CAN CREAM,5478
RED GINGHAM ROSE JEWELLERY BOX,4743
RECIPE BOX PANTRY YELLOW DESIGN,6955
RECIPE BOX RETROSPOT ,4546
REX CASH+CARRY JUMBO SHOPPER,1403
ENAMEL COLANDER CREAM,1337
SET/6 RED SPOTTY PAPER CUPS,4072
BLUE POLKADOT CUP,1848
PINK  POLKADOT CUP,6415
RED RETROSPOT CUP,4358
BAKING SET SPACEBOY DESIGN,5770
PAPER CHAIN KIT RETROSPOT,2242
SMALL POPCORN HOLDER,1794
CIRCUS PARADE LUNCH BOX ,4667
BREAD BIN DINER STYLE IVORY,6316
SET/3 RED GINGHAM ROSE STORAGE BOX,4626
DOORSTOP RETROSPOT HEART,1584
WOODEN FRAME ANTIQUE WHITE ,3124
BLACK/BLUE POLKADOT UMBRELLA,4936
WHITE HANGING HEART T-LIGHT HOLDER,6465
BAKING SET SPACEBOY DESIGN,1986
SMALL POPCORN HOLDER,1576
SET OF 3 BLACK FLYING DUCKS,6691
SET OF 3 BLACK FLYING DUCKS,5032
RED RETROSPOT TRADITIONAL TEAPOT ,5778
BROCANTE SHELF WITH HOOKS,1348
ANTIQUE SILVER TEA GLASS ETCHED,6002
COLOUR GLASS. STAR T-LIGHT HOLDER,1736
WORLD WAR 2 GLIDERS ASSTD DESIGNS,1116
RED  HARMONICA IN BOX ,4008
WHITE WIRE EGG HOLDER,4773
FRYING PAN UNION FLAG,5069
JUMBO BAG PINK VINTAGE PAISLEY,5303
JUMBO BAG SCANDINAVIAN PAISLEY,6300
BLUE/CREAM STRIPE CUSHION COVER ,6286
UNION STRIPE CUSHION COVER ,3158
COLOUR GLASS. STAR T-LIGHT HOLDER,1348
RED HANGING HEART T-LIGHT HOLDER,2784
KEY CABINET MA CAMPAGNE,3089
SOAP DISH BROCANTE,2614
CREAM CUPID HEARTS COAT HANGER,2460
CREAM SWEETHEART MINI CHEST,5001
WHITE HANGING HEART T-LIGHT HOLDER,3698
HANGING HEART ZINC T-LIGHT HOLDER,3984
ASSORTED COLOUR MINI CASES,4113
FAIRY CAKE DESIGN UMBRELLA,6381
RED RETROSPOT UMBRELLA,4655
HANGING METAL HEART LANTERN,1997
HANGING METAL STAR LANTERN,4087
SQUARECUSHION COVER PINK UNION FLAG,1933
WHITE METAL LANTERN,6744
HOMEMADE JAM SCENTED CANDLES,3657
SET OF 6 T-LIGHTS SNOWMEN,4855
RED STAR CARD HOLDER,4250
GREEN CHRISTMAS TREE CARD HOLDER,3940
CHRISTMAS CRAFT TREE TOP ANGEL,2858
CHRISTMAS CRAFT LITTLE FRIENDS,2547
NOEL WOODEN BLOCK LETTERS ,5680
PEACE SMALL WOOD LETTERS,4088
STAR WOODEN CHRISTMAS DECORATION,6554
SWALLOW WOODEN CHRISTMAS DECORATION,1833
WOODEN STAR CHRISTMAS SCANDINAVIAN,3969
CHRISTMAS GINGHAM STAR,6311
CHRISTMAS GINGHAM HEART,4035
FOLKART ZINC HEART CHRISTMAS DEC,6443
DINOSAUR PARTY BAG + STICKER SET,6281
PAPER CHAIN KIT VINTAGE CHRISTMAS,4068
CHRISTMAS PUDDING TRINKET POT ,4834
IVY HEART WREATH,5431
EUCALYPTUS & PINECONE  WREATH,6858
VINTAGE UNION JACK BUNTING,5484
"SWISS ROLL TOWEL, CHOCOLATE  SPOTS",3417
VINTAGE RED KITCHEN CABINET,2105
SWEETHEART CERAMIC TRINKET BOX,6675
STRAWBERRY CERAMIC TRINKET BOX,5041
LARGE CAKE STAND HANGING HEARTS,1973
CERAMIC CAKE STAND + HANGING CAKES,6578
LARGE CAKE STAND  HANGING STRAWBERY,1738
RED RETROSPOT CAKE STAND,5107
RED RETROSPOT SUGAR JAM BOWL,4339
RED RETROSPOT BUTTER DISH,5136
LARGE POPCORN HOLDER ,2704
SMALL POPCORN HOLDER,3762
HAND WARMER UNION JACK,5683
RETROSPOT LAMP,5789
RED SPOTTY BISCUIT TIN,2474
RED RETROSPOT PEG BAG,4906
RED RETROSPOT SHOPPING BAG,1576
RED RETROSPOT WASHBAG,3309
RED RETROSPOT OVEN GLOVE DOUBLE,5964
RED RETROSPOT OVEN GLOVE ,4750
RED RETROSPOT OVEN GLOVE ,1370
SET/2 RED RETROSPOT TEA TOWELS ,1698
TEA TIME TABLE CLOTH,3920
TEA TIME KITCHEN APRON,2359
TEA TIME OVEN GLOVE,1306
RED DINER WALL CLOCK,4277
STRAWBERRY FAIRY CAKE TEAPOT,1390
WRAP PINK FAIRY CAKES ,3125
WRAP ENGLISH ROSE ,1334
WOOD S/3 CABINET ANT WHITE FINISH,5014
WOOD 2 DRAWER CABINET WHITE FINISH,5798
WOODEN PICTURE FRAME WHITE FINISH,3482
HOME BUILDING BLOCK WORD,6688
LOVE BUILDING BLOCK WORD,3766
WOODEN FRAME ANTIQUE WHITE ,2392
3 HOOK PHOTO SHELF ANTIQUE WHITE,2735
WRAP  PINK FLOCK,4440
CHOCOLATE HOT WATER BOTTLE,4969
PACK OF 12 RED RETROSPOT TISSUES ,3398
PINK HEART DOTS HOT WATER BOTTLE,3234
PINK CREAM FELT CRAFT TRINKET BOX ,6169
HOT WATER BOTTLE TEA AND SYMPATHY,2801
CHRISTMAS CRAFT LITTLE FRIENDS,4184
HAND WARMER OWL DESIGN,1633
HAND WARMER UNION JACK,5929
HEART OF WICKER LARGE,5310
HAND WARMER RED RETROSPOT,3944
TRADITIONAL CHRISTMAS RIBBONS,4532
12 PENCILS TALL TUBE POSY,1138
TUB 24 PINK FLOWER PEGS,3076
CANDLEHOLDER PINK HANGING HEART,2668
12 PENCILS TALL TUBE WOODLAND,4373
METAL 4 HOOK HANGER FRENCH CHATEAU,3812
WHITE HANGING HEART T-LIGHT HOLDER,4957
BLUE POLKADOT WRAP,1114
PINK POLKADOT WRAP ,1356
ASSORTED COLOURS SILK FAN,5160
FENG SHUI PILLAR CANDLE,5666
CHINESE DRAGON PAPER LANTERNS,5970
WORLD WAR 2 GLIDERS ASSTD DESIGNS,4498
DOORMAT RED RETROSPOT,1905
DOORMAT SPOTTY HOME SWEET HOME,1382
SET 12 RETRO WHITE CHALK STICKS,1965
VINTAGE KID DOLLY CARD ,6696
TEA PARTY BIRTHDAY CARD,3531
SWALLOWS GREETING CARD,2346
SPACEBOY BIRTHDAY CARD,2930
GIN & TONIC DIET GREETING CARD ,5184
"FANCY FONT BIRTHDAY CARD, ",3794
EMPIRE BIRTHDAY CARD,5697
"ELEPHANT, BIRTHDAY CARD, ",5976
"DECOUPAGE,GREETING CARD,",6377
COWBOYS AND INDIANS BIRTHDAY CARD ,2105
ASSORTED COLOUR BIRD ORNAMENT,6758
PACK OF 6 BIRDY GIFT TAGS,4117
JAM MAKING SET PRINTED,6733
JAM JAR WITH PINK LID,3112
JAM JAR WITH GREEN LID,6469
SWEETHEART CAKESTAND 3 TIER,2581
60 CAKE CASES VINTAGE CHRISTMAS,3645
6 RIBBONS RUSTIC CHARM,5727
CAKE STAND WHITE TWO TIER LACE,3207
PACK OF 60 PINK PAISLEY CAKE CASES,4646
60 TEATIME FAIRY CAKE CASES,3235
PACK OF 72 RETROSPOT CAKE CASES,6635
POSTAGE,1343
PHOTO FRAME CORNICE,5646
FAMILY PHOTO FRAME CORNICE,4556
FIRST AID TIN,5775
FAMILY ALBUM WHITE PICTURE FRAME,5153
ASSORTED COLOUR BIRD ORNAMENT,5695
3 HOOK PHOTO SHELF ANTIQUE WHITE,6220
PICTURE FRAME WOOD TRIPLE PORTRAIT,5310
HEART OF WICKER LARGE,2335
HEART OF WICKER SMALL,1307
HOMEMADE JAM SCENTED CANDLES,5958
CLEAR DRAWER KNOB ACRYLIC EDWARDIAN,6445
PINK DRAWER KNOB ACRYLIC EDWARDIAN,6789
PURPLE DRAWERKNOB ACRYLIC EDWARDIAN,4090
SET3 BOOK BOX GREEN GINGHAM FLOWER ,2201
RED GINGHAM ROSE JEWELLERY BOX,1566
SET/3 RED GINGHAM ROSE STORAGE BOX,4801
6 RIBBONS RUSTIC CHARM,1843
CHARLOTTE BAG PINK POLKADOT,6423
RED RETROSPOT CHARLOTTE BAG,2311
SET OF 3 NOTEBOOKS IN PARCEL,2386
ANTIQUE GLASS HEART DECORATION ,1176
CREAM SWEETHEART LETTER RACK,4291
LUNCH BAG WOODLAND,4485
36 PENCILS TUBE WOODLAND,4509
BOX OF VINTAGE JIGSAW BLOCKS ,3877
BAKING SET SPACEBOY DESIGN,1887
PICNIC BASKET WICKER SMALL,3681
PINK HAPPY BIRTHDAY BUNTING,6457
BLUE HAPPY BIRTHDAY BUNTING,6970
PACK OF 12 WOODLAND TISSUES ,3877
PACK OF 6 PANNETONE GIFT BOXES,6250
JUMBO BAG CHARLIE AND LOLA TOYS,2625
PLASTERS IN TIN SPACEBOY,5066
GINGERBREAD MAN COOKIE CUTTER,1651
NOVELTY BISCUITS CAKE STAND 3 TIER,1471
PICNIC BASKET WICKER SMALL,3882
SET/3 RED GINGHAM ROSE STORAGE BOX,1960
ROUND CAKE TIN VINTAGE GREEN,2459
RED 3 PIECE RETROSPOT CUTLERY SET,2094
LUNCH BAG PINK POLKADOT,4342
DAIRY MAID TOASTRACK,4391
DAIRY MAID TRADITIONAL TEAPOT ,4591
CHILDS BREAKFAST SET DOLLY GIRL ,3072
AGED GLASS SILVER T-LIGHT HOLDER,2554
ZINC WILLIE WINKIE  CANDLE STICK,6543
TRADITIONAL WOODEN SKIPPING ROPE,5540
SET/3 VANILLA SCENTED CANDLE IN BOX,4768
CLASSIC WHITE FRAME,6093
GLITTER HEART GARLAND WITH BELLS ,3356
GLITTER STAR GARLAND WITH BELLS ,1333
HEART GARLAND RUSTIC PADDED,2873
LUNCH BAG  BLACK SKULL.,4330
SET OF 6 SOLDIER SKITTLES,4443
WHITE SKULL HOT WATER BOTTLE ,4272
KNITTED UNION FLAG HOT WATER BOTTLE,3626
FOLDING UMBRELLA RED/WHITE POLKADOT,1712
LAVENDER SCENTED FABRIC HEART,2246
LUNCH BAG RED RETROSPOT,3210
ROUND SNACK BOXES SET OF 4 SKULLS,4314
36 PENCILS TUBE SKULLS,6734
36 PENCILS TUBE RED RETROSPOT,3670
CHILDS BREAKFAST SET CIRCUS PARADE,5658
BLACK/BLUE POLKADOT UMBRELLA,2301
BLUE POLKADOT PASSPORT COVER,3327
CHILDS BREAKFAST SET SPACEBOY ,3075
FELTCRAFT DOLL ROSIE,3111
WHITE SKULL HOT WATER BOTTLE ,5326
HEART OF WICKER SMALL,1297
HOME BUILDING BLOCK WORD,1877
RECIPE BOX PANTRY YELLOW DESIGN,2427
RECIPE BOX BLUE SKETCHBOOK DESIGN,5446
RECIPE BOX RETROSPOT ,6551
SET 7 BABUSHKA NESTING BOXES,4304
SWEETHEART CAKESTAND 3 TIER,5310
SET/5 RED RETROSPOT LID GLASS BOWLS,5396
ENAMEL FLOWER JUG CREAM,3249
SWEETHEART WIRE MAGAZINE RACK,2157
ENAMEL WASH BOWL CREAM,5588
ENAMEL BREAD BIN CREAM,4545
CHILDRENS APRON SPACEBOY DESIGN,2694
RETROSPOT CHILDRENS APRON,1788
RED KITCHEN SCALES,3302
IVORY KITCHEN SCALES,4012
REGENCY CAKESTAND 3 TIER,6036
REX CASH+CARRY JUMBO SHOPPER,2209
LUNCH BAG CARS BLUE,2226
LUNCH BAG SPACEBOY DESIGN ,5237
10 COLOUR SPACEBOY PEN,5727
HEART OF WICKER LARGE,1632
CERAMIC STRAWBERRY CAKE MONEY BANK,1913
COLOUR GLASS. STAR T-LIGHT HOLDER,3363
VINTAGE SNAKES & LADDERS,6184
CHRISTMAS CRAFT WHITE FAIRY ,6285
WHITE SPOT BLUE CERAMIC DRAWER KNOB,4744
BLUE STRIPE CERAMIC DRAWER KNOB,1853
RED STRIPE CERAMIC DRAWER KNOB,6350
BLUE SPOT CERAMIC DRAWER KNOB,6928
RED STRIPE CERAMIC DRAWER KNOB,1683
RED SPOT CERAMIC DRAWER KNOB,2816
WHITE SPOT BLUE CERAMIC DRAWER KNOB,1049
SET/6 BEAD COASTERS GAUZE BAG GOLD,1564
HAND WARMER BABUSHKA DESIGN,4380
GREY HEART HOT WATER BOTTLE,6611
GROW YOUR OWN HERBS SET OF 3,3327
GROW YOUR OWN FLOWERS SET OF 3,5405
REX CASH+CARRY JUMBO SHOPPER,6137
WOODEN FRAME ANTIQUE WHITE ,1962
FAIRY CAKE DESIGN UMBRELLA,1777
FELTCRAFT 6 FLOWER FRIENDS,3259
CHEST OF DRAWERS GINGHAM HEART ,1850
PINK POLKADOT CHILDRENS UMBRELLA,3442
WOODEN ROUNDERS GARDEN SET ,1277
WOODEN CROQUET GARDEN SET,5314
MEMO BOARD COTTAGE DESIGN,4219
PICNIC BASKET WICKER LARGE,1656
12 PENCILS TALL TUBE RED RETROSPOT,2629
12 PENCILS TALL TUBE SKULLS,4615
12 PENCILS SMALL TUBE SKULL,3886
FELTCRAFT DOLL ROSIE,3306
PINK BLUE FELT CRAFT TRINKET BOX,1966
PINK CREAM FELT CRAFT TRINKET BOX ,2627
FELTCRAFT CHRISTMAS FAIRY,4386
FELTCRAFT PRINCESS LOLA DOLL,3632
FELTCRAFT PRINCESS CHARLOTTE DOLL,5656
FELTCRAFT DOLL MARIA,5024
FELTCRAFT PRINCESS OLIVIA DOLL,4072
FELTCRAFT DOLL EMILY,6135
HOT WATER BOTTLE BABUSHKA ,1396
12 PENCILS TALL TUBE SKULLS,3724
TRADITIONAL WOODEN SKIPPING ROPE,2108
GREY HEART HOT WATER BOTTLE,4507
SET 10 LIGHTS NIGHT OWL,6279
BABUSHKA LIGHTS STRING OF 10,1786
TRADITIONAL WOODEN CATCH CUP GAME ,4184
CHRISTMAS CRAFT TREE TOP ANGEL,1532
RETROSPOT LAMP,1248
12 PENCILS TALL TUBE RED RETROSPOT,4794
12 PENCILS SMALL TUBE RED RETROSPOT,6605
12 PENCILS TALL TUBE RED RETROSPOT,1672
12 PENCILS SMALL TUBE SKULL,1121
PICNIC BASKET WICKER SMALL,6644
PHOTO FRAME CORNICE,4179
BAKING SET SPACEBOY DESIGN,1195
STAR DECORATION RUSTIC,1326
WHITE CHRISTMAS STAR DECORATION,5187
HEART DECORATION RUSTIC HANGING ,3841
CHRISTMAS PUDDING TRINKET POT ,1941
PORCELAIN T-LIGHT HOLDERS ASSORTED,6895
ROTATING SILVER ANGELS T-LIGHT HLDR,1911
SWEETHEART CERAMIC TRINKET BOX,1028
STRAWBERRY CERAMIC TRINKET BOX,3066
CHOC TRUFFLE GOLD TRINKET POT ,2949
PAPER CHAIN KIT VINTAGE CHRISTMAS,2516
JUMBO STORAGE BAG SKULLS,1136
JUMBO BAG SCANDINAVIAN PAISLEY,6316
ALARM CLOCK BAKELIKE IVORY,2709
ALARM CLOCK BAKELIKE RED ,5616
ALARM CLOCK BAKELIKE PINK,6779
CHRISTMAS LIGHTS 10 SANTAS ,3018
DOORMAT MERRY CHRISTMAS RED ,1106
CARDHOLDER GINGHAM CHRISTMAS TREE,6973
ADVENT CALENDAR GINGHAM SACK,5320
RED STAR CARD HOLDER,5054
RED RETROSPOT CHILDRENS UMBRELLA,1684
SCOTTIE DOG HOT WATER BOTTLE,2381
RETROSPOT HEART HOT WATER BOTTLE,1182
PARTY CONES CANDY ASSORTED,5648
ASSORTED COLOUR MINI CASES,5712
WASH BAG VINTAGE ROSE PAISLEY,3957
CABIN BAG VINTAGE PAISLEY,5047
SET/3 RED GINGHAM ROSE STORAGE BOX,1135
RED GINGHAM ROSE JEWELLERY BOX,4280
SET3 BOOK BOX GREEN GINGHAM FLOWER ,6339
RETROSPOT PARTY BAG + STICKER SET,6223
RETROSPOT LAMP,4375
CABIN BAG VINTAGE RETROSPOT,1620
SET/6 RED SPOTTY PAPER PLATES,3864
SET/6 RED SPOTTY PAPER CUPS,3707
PICTURE DOMINOES,4797
MINI JIGSAW SPACEBOY,3487
MINI JIGSAW DOLLY GIRL,4260
CHARLOTTE BAG DOLLY GIRL DESIGN,4668
VINTAGE HEADS AND TAILS CARD GAME ,3936
POLKADOT RAIN HAT ,5157
POSTAGE,1111
CLASSICAL ROSE SMALL VASE,2721
3 HEARTS HANGING DECORATION RUSTIC,6220
CHRISTMAS METAL POSTCARD WITH BELLS,3018
SAVE THE PLANET MUG,1572
RED RETROSPOT TRADITIONAL TEAPOT ,5484
HAND WARMER RED POLKA DOT,4835
CHRISTMAS LIGHTS 10 REINDEER,3543
CHRISTMAS LIGHTS 10 VINTAGE BAUBLES,4096
COSY HOUR CIGAR BOX MATCHES ,6804
FAMILY ALBUM WHITE PICTURE FRAME,2207
SET OF 3 NOTEBOOKS IN PARCEL,6406
JAM MAKING SET WITH JARS,3186
BOX OF VINTAGE ALPHABET BLOCKS,2385
REGENCY CAKESTAND 3 TIER,3758
BOX OF VINTAGE JIGSAW BLOCKS ,1308
POPPY'S PLAYHOUSE KITCHEN,2429
POPPY'S PLAYHOUSE LIVINGROOM ,1007
POPPY'S PLAYHOUSE BEDROOM ,4196
POPPY'S PLAYHOUSE BATHROOM,6546
WORLD WAR 2 GLIDERS ASSTD DESIGNS,4657
VINTAGE SNAP CARDS,1040
VINTAGE HEADS AND TAILS CARD GAME ,5965
PICTURE DOMINOES,4016
4 TRADITIONAL SPINNING TOPS,1032
TRADITIONAL KNITTING NANCY,1547
CHILDS BREAKFAST SET CIRCUS PARADE,1209
CHILDS BREAKFAST SET DOLLY GIRL ,3065
FELTCRAFT CHRISTMAS FAIRY,2577
MODERN FLORAL STATIONERY SET,1863
FLORAL FOLK STATIONERY SET,3343
MULTI COLOUR SILVER T-LIGHT HOLDER,3339
VINTAGE CREAM CAT FOOD CONTAINER,5228
LOVE BUILDING BLOCK WORD,5553
ROSES REGENCY TEACUP AND SAUCER ,2111
GREEN REGENCY TEACUP AND SAUCER,2303
ANTIQUE GLASS DRESSING TABLE POT,4626
WOODEN BOX OF DOMINOES,5933
ANTIQUE TALL SWIRLGLASS TRINKET POT,1611
MOROCCAN TEA GLASS,3223
HAND WARMER BABUSHKA DESIGN,2826
HAND WARMER OWL DESIGN,4136
BABUSHKA LIGHTS STRING OF 10,3559
S/6 WOODEN SKITTLES IN COTTON BAG,3501
TRADITIONAL WOODEN CATCH CUP GAME ,2442
 SET 2 TEA TOWELS I LOVE LONDON ,1424
WHITE HANGING HEART T-LIGHT HOLDER,6881
CANDLEHOLDER PINK HANGING HEART,2812
FAUX FUR CHOCOLATE THROW,3370
RIBBON REEL LACE DESIGN ,5721
SCANDINAVIAN REDS RIBBONS,6247
LUSH GREENS RIBBONS,3751
BRIGHT BLUES RIBBONS ,6843
CHOCOLATE BOX RIBBONS ,5739
ROMANTIC PINKS RIBBONS ,5546
BABY BOOM RIBBONS ,2613
MEMO BOARD RETROSPOT  DESIGN,4274
URBAN BLACK RIBBONS ,6424
GLASS STAR FROSTED T-LIGHT HOLDER,2037
I CAN ONLY PLEASE ONE PERSON MUG,2978
CERAMIC CAKE STAND + HANGING CAKES,5030
CLOTHES PEGS RETROSPOT PACK 24 ,5619
ROUND SNACK BOXES SET OF4 WOODLAND ,6406
PLASTERS IN TIN WOODLAND ANIMALS,3808
RED TOADSTOOL LED NIGHT LIGHT,2455
PINK POLKADOT BOWL,1848
RED RETROSPOT MINI CASES,1689
POSTAGE,6109
POPPY'S PLAYHOUSE BEDROOM ,6844
PACK OF 6 SANDCASTLE FLAGS ASSORTED,1447
ROUND CAKE TIN VINTAGE GREEN,2161
BOX OF 24 COCKTAIL PARASOLS,5830
CHRISTMAS LIGHTS 10 VINTAGE BAUBLES,6324
PAPER CHAIN KIT 50'S CHRISTMAS ,1882
CHRISTMAS GINGHAM HEART,1169
CHRISTMAS GINGHAM TREE,4338
PAPER CHAIN KIT EMPIRE,3998
RED HANGING HEART T-LIGHT HOLDER,3438
WHITE HANGING HEART T-LIGHT HOLDER,5273
PAPER CHAIN KIT RETROSPOT,5191
RIBBON REEL CHRISTMAS PRESENT ,3343
"NURSERY A,B,C PAINTED LETTERS",3583
PACK OF 6 SWEETIE GIFT BOXES,5912
PACK OF 6 PANNETONE GIFT BOXES,3547
PACK OF 6 BIRDY GIFT TAGS,6142
PACK 3 BOXES CHRISTMAS PANNETONE,1207
YULETIDE IMAGES GIFT WRAP SET,6518
PARTY CONE CHRISTMAS DECORATION ,1875
